Handle,Command,Title,Body HTML,Must Match,Rule: Product Column,Rule: Relation,Rule: Condition,Metafield: title_tag [string],Metafield: description_tag [string]
accessories,MERGE,Accessories,Gør dit Accessories ur mere personlig med et ny rem. Vi har et stort udvalg af alle slags urremme med perfekt pasform.,all conditions,Tag,Equals,Accessories,Accessories Urremme | Kæmpe Udvalg,"Alle slags Accessories Urremme. Danmarks Største Udvalg. Gratis Levering ved køb over 199,-"
cables,MERGE,Cables,"Stort udvalg af Cables urremme. Hvis din stil er sporty eller klassisk, så kan du med garanti finde en urrem, der passer netop dig. Bestil inden. kl. 15 og vi sender hjem til dig i dag.",all conditions,Tag,Equals,Cables,"Cables Remme | Remme & Tilbehør - Fri Fragt over 199,-","Uremme der passer perfekt til Cables. Vores lager er fyldt med flotte remme til ganske få kroner. Køber du for mere end 199kroner, betaler vi fragten."
garmin-forerunner-205,MERGE,Garmin Forerunner 205,Mangler du en elegant eller behagelig Garmin Forerunner 205 urrem? Så er du heldig at du er landet hos os! Hos urrem.dk finder du Danmarks Største Udvalg af Garmin Forerunner 205 remme.,all conditions,Tag,Equals,Garmin Forerunner 205,Garmin Forerunner 205 Remme | Enormt Udvalg,Ny Garmin Forerunner 205 rem? Så er dette stedet for dig! Vi har det største udvalg i Danmark. Hurtig Levering.
garmin-forerunner-305,MERGE,Garmin Forerunner 305,"Her kan du finde en ny Garmin Forerunner 305 urrem. Du er heldigvis landet på danmarks største udvalg af smartwatch remme, så du kan helt sikkert finde noget du kan bruge.",all conditions,Tag,Equals,Garmin Forerunner 305,"Garmin Forerunner 305 Urremme | Bedste Udvalg - Fri Fragt over 199,-",Lækre remme til Garmin Forerunner 305. Kæmpe Udvalg. Hurtig Levering og FRI Fragt over 199kr.
apple-accessories,MERGE,Apple Accessories,"Stort udvalg af Apple Accessories urremme. Hvis din stil er sporty eller klassisk, så kan du med garanti finde en urrem, der passer netop dig. Bestil inden. kl. 15 og vi sender hjem til dig i dag.",all conditions,Tag,Equals,Apple Accessories,Apple Accessories Urremme | Find en ny rem til Apple Accessories Her,"Velkommen til et hav af Apple Accessories Urremme. Bestil inden kl. 15 og vi sender samme dag. Fri Fragt ved køb over 199,-"
lightning-cables,MERGE,Lightning Cables,"Her kan du finde en ny Lightning Cables urrem. Du er heldigvis landet på danmarks største udvalg af smartwatch remme, så du kan helt sikkert finde noget du kan bruge.",all conditions,Tag,Equals,Lightning Cables,"Lightning Cables Remme | Urremme & Tilbehør - Fri Levering over 199,-",Lækre remme til Lightning Cables. Kæmpe Udvalg. Hurtig Levering og FRI Fragt over 199kr.
motorola-moto-360-3rd-gen,MERGE,Motorola Moto 360 (3rd Gen),"Leder du efter en ny Motorola Moto 360 (3rd Gen) urrem? Så er du kommet til det rigtige sted! Vi har et hav af remme. Du finder <b>Danmarks største udvalg</b>, til at priser der er til at betale. Køb netop den rem, der passer perfekt ind til din livsstil. Husk at fylder du kurven for mere end 199KR, så betaler vi forsendelsen.",all conditions,Tag,Equals,Motorola Moto 360 (3rd Gen),Motorola Moto 360 (3rd Gen) Remme | Danmarks Største Udvalg af remme til Motorola Moto 360 (3rd Gen),"Kæmpe Udvalg af Motorola Moto 360 (3rd Gen) Urremme. Køb for 199,- og vi betaler Fragten. Hurtigt Service. Danmarks Største Udvalg af Remme."
stands-holders,MERGE,Stands & Holders,"Stort udvalg af Stands & Holders urremme. Hvis din stil er sporty eller klassisk, så kan du med garanti finde en urrem, der passer netop dig. Bestil inden. kl. 15 og vi sender hjem til dig i dag.",all conditions,Tag,Equals,Stands & Holders,Stands & Holders Remme | Kæmpestort Udvalg af Remme til Stands & Holders,Stort Sortiment af Stands & Holders Urremme. Hurtig Levering. Bedste udvalg og høj service. Find din nye rem i dag.
stylus-pens,MERGE,Stylus Pens,Mangler du en ny Stylus Pens urrem? Så kan vi hjælpe dig. Vi har det største udvalg af urremme i Danmark.,all conditions,Tag,Equals,Stylus Pens,Stylus Pens Remme | Køb ny Urrem til Stylus Pens Her,"Kæmpe Udvalg af Stylus Pens Urremme. Køb for 199,- og vi betaler Fragten. Hurtigt Service. Danmarks Største Udvalg af Remme."
