Handle,Command,Title,Body HTML,Must Match,Rule: Product Column,Rule: Relation,Rule: Condition,Metafield: title_tag [string],Metafield: description_tag [string]
huawei-watch-gt-2-pro-porsche-design,MERGE,Huawei Watch GT 2 Pro (Porsche Design),Mangler du en elegant eller behagelig Huawei Watch GT 2 Pro (Porsche Design) urrem? Så er du heldig at du er landet hos os! Hos urrem.dk finder du Danmarks Største Udvalg af Huawei Watch GT 2 Pro (Porsche Design) remme.,all conditions,Tag,Equals,Huawei Watch GT 2 Pro (Porsche Design),"Huawei Watch GT 2 Pro (Porsche Design) Urremme | Hurtig & Gratis Fragt over 199,-","Velkommen til et hav af Huawei Watch GT 2 Pro (Porsche Design) Urremme. Bestil inden kl. 15 og vi sender samme dag. Fri Fragt ved køb over 199,-"
amazfit-gtr-2-esim,MERGE,Amazfit GTR 2 eSIM,Mangler du en ny Amazfit GTR 2 eSIM urrem? Så kan vi hjælpe dig. Vi har det største udvalg af urremme i Danmark.,all conditions,Tag,Equals,Amazfit GTR 2 eSIM,Amazfit GTR 2 eSIM Remme | Lækre Urremme til Amazfit GTR 2 eSIM,Ny Amazfit GTR 2 eSIM rem? Så er dette stedet for dig! Vi har det største udvalg i Danmark. Hurtig Levering.
huawei-watch-d,MERGE,Huawei Watch D,Er det på tide at udskifte remmen? Du finder et vælg af <b>Huawei Watch D urremme</b> her hos Danmarks største udvalg.,all conditions,Tag,Equals,Huawei Watch D,Huawei Watch D Remme | Danmarks Største Udvalg af remme til Huawei Watch D,Stort Sortiment af Huawei Watch D Urremme. Hurtig Levering. Bedste udvalg og høj service. Find din nye rem i dag.
vivo,MERGE,Vivo,"Leder du efter en ny Vivo urrem? Så er du kommet til det rigtige sted! Vi har et hav af remme. Du finder <b>Danmarks største udvalg</b>, til at priser der er til at betale. Køb netop den rem, der passer perfekt ind til din livsstil. Husk at fylder du kurven for mere end 199KR, så betaler vi forsendelsen.",all conditions,Tag,Equals,Vivo,"Vivo Urremme | Hurtig & Gratis Levering over 199,-","Uremme til Vivo hos Danmarks Største Udvalg. Bestil inden. Kl 15 og vi sender i Dag. Køb for mere end 199,- og du får Gratis Fragt."
haylou-solar-ls02,MERGE,Haylou Solar LS02,Danmarks Bedste Udvalg af Haylou Solar LS02 urremme. Den rem du leder efter finder du her på siden. Vi har i mange forskellige materialer og stilarter. Find den urrem du mangler i dag!,all conditions,Tag,Equals,Haylou Solar LS02,Haylou Solar LS02 Remme | Stort Sortiment af Urremme til Haylou Solar LS02,Er det på tide at udskifte din Haylou Solar LS02 rem? Her kan du købe en nye til få penge. Vi sender inden kl. 15
huawei-watch-fit-2,MERGE,Huawei Watch Fit 2,"Skal du bruge en ny Huawei Watch Fit 2 urrem til enten træning eller hverdagen, så har vi heldigvis et hav af forskellige remme, som du kan vælge imellem.",all conditions,Tag,Equals,Huawei Watch Fit 2,Huawei Watch Fit 2 Urremme | Stort Sortiment af Remme til Huawei Watch Fit 2,"Mangler du en ny Huawei Watch Fit 2 urrem? Her finder du et stort udvalg af alle slags remme. GRATIS fragt ved køb over 199,-"
apple-watch-series-8-45mm,MERGE,Apple Watch Series 8 (45mm),"Find en ny Apple Watch Series 8 (45mm) rem i dag, eller få et ekstra, så du kan skifte imellem forskellige. En urrem kan give dit smartwatch et helt nyt look, og matche din egen personlige stil.",all conditions,Tag,Equals,Apple Watch Series 8 (45mm),Apple Watch Series 8 (45mm) Remme | Mægtigt Sortiment,Lækre remme til Apple Watch Series 8 (45mm). Kæmpe Udvalg. Hurtig Levering og FRI Fragt over 199kr.
apple-watch-series-8-41mm,MERGE,Apple Watch Series 8 (41mm),"Her kan du finde en ny Apple Watch Series 8 (41mm) urrem. Du er heldigvis landet på danmarks største udvalg af smartwatch remme, så du kan helt sikkert finde noget du kan bruge.",all conditions,Tag,Equals,Apple Watch Series 8 (41mm),"Apple Watch Series 8 (41mm) Remme | Urremme & Tilbehør - Fri Levering over 199,-","Velkommen til et hav af Apple Watch Series 8 (41mm) Urremme. Bestil inden kl. 15 og vi sender samme dag. Fri Fragt ved køb over 199,-"
xiaomi-mi-band-7-pro,MERGE,Xiaomi Mi Band 7 Pro,"Skal du bruge en ny Xiaomi Mi Band 7 Pro urrem til enten træning eller hverdagen, så har vi heldigvis et hav af forskellige remme, som du kan vælge imellem.",all conditions,Tag,Equals,Xiaomi Mi Band 7 Pro,Xiaomi Mi Band 7 Pro Urremme | Største Udvalg i Danmark,"Alle slags Xiaomi Mi Band 7 Pro Urremme. Danmarks Største Udvalg. Gratis Levering ved køb over 199,-"
