Handle,Command,Title,Body HTML,Must Match,Rule: Product Column,Rule: Relation,Rule: Condition,Metafield: title_tag [string],Metafield: description_tag [string],Template Suffix,Metafield: custom.belongs_to [single_line_text_field]
garmin-approach-s20,Merge,Garmin Approach S20,Danmarks Bedste Udvalg af Garmin Approach S20 urremme. Den rem du leder efter finder du her på siden. Vi har i mange forskellige materialer og stilarter. Find den urrem du mangler i dag!,all conditions,Tag,Equals,Garmin Approach S20,Garmin Approach S20 Rem | Bedste Udvalg Remme til Garmin Approach S20,Ny Garmin Approach S20 rem? Så er dette stedet for dig! Vi har det største udvalg i Danmark. Hurtig Levering.,,
garmin-approach-s3,Merge,Garmin Approach S3,"Velkommen til et godt udvalg af Garmin Approach S3 urremme. Fylder du kurven for mere end 199kroner, så får du <b>gratis levering.</b>.",all conditions,Tag,Equals,Garmin Approach S3,"Garmin Approach S3 Urremme | Remme & Tilbehør - Fri Fragt over 199,-","Mangler du en ny Garmin Approach S3 urrem? Her finder du et stort udvalg af alle slags remme. GRATIS fragt ved køb over 199,-",,
garmin-approach-s4,Merge,Garmin Approach S4,Mangler du en ny Garmin Approach S4 urrem? Så kan vi hjælpe dig. Vi har det største udvalg af urremme i Danmark.,all conditions,Tag,Equals,Garmin Approach S4,Garmin Approach S4 Remme | Bedste Udvalg,"Uremme til Garmin Approach S4 hos Danmarks Største Udvalg. Bestil inden. Kl 15 og vi sender i Dag. Køb for mere end 199,- og du får Gratis Fragt.",,
garmin-approach-s40,Merge,Garmin Approach S40,Mangler du en elegant eller behagelig Garmin Approach S40 urrem? Så er du heldig at du er landet hos os! Hos urrem.dk finder du Danmarks Største Udvalg af Garmin Approach S40 remme.,all conditions,Tag,Equals,Garmin Approach S40,"Garmin Approach S40 Remme | Remme & Tilbehør - Fri Fragt over 199,-",Er det på tide at udskifte din Garmin Approach S40 rem? Her kan du købe en nye til få penge. Vi sender inden kl. 15,,
garmin-approach-s50,Merge,Garmin Approach S50,"Her kan du finde en ny Garmin Approach S50 urrem. Du er heldigvis landet på danmarks største udvalg af smartwatch remme, så du kan helt sikkert finde noget du kan bruge.",all conditions,Tag,Equals,Garmin Approach S50,Garmin Approach S50 Remme | Mægtigt Udvalg,Er det på tide at udskifte din Garmin Approach S50 rem? Her kan du købe en nye til få penge. Vi sender inden kl. 15,,
garmin-approach-s6,Merge,Garmin Approach S6,Er det på tide at udskifte remmen? Du finder et vælg af <b>Garmin Approach S6 urremme</b> her hos Danmarks største udvalg.,all conditions,Tag,Equals,Garmin Approach S6,Garmin Approach S6 Urremme | Køb ny rem til Garmin Approach S6 Her,"Mangler du en ny Garmin Approach S6 urrem? Her finder du et stort udvalg af alle slags remme. GRATIS fragt ved køb over 199,-",,
garmin-approach-s60,Merge,Garmin Approach S60,Mangler du en ny Garmin Approach S60 urrem? Så kan vi hjælpe dig. Vi har det største udvalg af urremme i Danmark.,all conditions,Tag,Equals,Garmin Approach S60,Garmin Approach S60 Remme | Stort Sortiment af Urremme til Garmin Approach S60,"Uremme til Garmin Approach S60 hos Danmarks Største Udvalg. Bestil inden. Kl 15 og vi sender i Dag. Køb for mere end 199,- og du får Gratis Fragt.",,
garmin-approach-s62,Merge,Garmin Approach S62,Mangler du en elegant eller behagelig Garmin Approach S62 urrem? Så er du heldig at du er landet hos os! Hos urrem.dk finder du Danmarks Største Udvalg af Garmin Approach S62 remme.,all conditions,Tag,Equals,Garmin Approach S62,Garmin Approach S62 Remme | Find en ny Urrem til Garmin Approach S62 Her,"Uremme til Garmin Approach S62 hos Danmarks Største Udvalg. Bestil inden. Kl 15 og vi sender i Dag. Køb for mere end 199,- og du får Gratis Fragt.",,
garmin-approach-x10,Merge,Garmin Approach X10,"Her har du hele vores udvalg af remme til Garmin Approach X10. Med en ny urrem kan du gøre dit smartwatch mere personlig. De er nemme at udskifte, så du kan også fylde skuffen med forskellige urremme og udskifte dem efter behov. Køber du får mere end 199,- så leverer vi kvit og frit.",all conditions,Tag,Equals,Garmin Approach X10,"Garmin Approach X10 Urremme | Hurtig & Fri Levering over 199,-","Uremme der passer perfekt til Garmin Approach X10. Vores lager er fyldt med flotte remme til ganske få kroner. Køber du for mere end 199kroner, betaler vi fragten.",,
garmin-approach-x40,Merge,Garmin Approach X40,Danmarks Bedste Udvalg af Garmin Approach X40 urremme. Den rem du leder efter finder du her på siden. Vi har i mange forskellige materialer og stilarter. Find den urrem du mangler i dag!,all conditions,Tag,Equals,Garmin Approach X40,Garmin Approach X40 Urremme | Bedste Udvalg Remme til Garmin Approach X40,Er det på tide at udskifte din Garmin Approach X40 rem? Her kan du købe en nye til få penge. Vi sender inden kl. 15,,
garmin-d2,Merge,Garmin D2,"Enormt udvalg af urremme til Garmin D2 . Vi har helt sikkert en rem, som du kan bruge.",all conditions,Tag,Equals,Garmin D2,"Garmin D2 Urremme | Hurtig & Gratis Fragt over 199,-","Velkommen til et hav af Garmin D2 Urremme. Bestil inden kl. 15 og vi sender samme dag. Fri Fragt ved køb over 199,-",,
garmin-d2-charlie,Merge,Garmin D2 Charlie,"Find en ny Garmin D2 Charlie rem i dag, eller få et ekstra, så du kan skifte imellem forskellige. En urrem kan give dit smartwatch et helt nyt look, og matche din egen personlige stil.",all conditions,Tag,Equals,Garmin D2 Charlie,Garmin D2 Charlie Urremme | Bedste Udvalg i Danmark,"Alle slags Garmin D2 Charlie Urremme. Danmarks Største Udvalg. Gratis Levering ved køb over 199,-",,
garmin-d2-delta,Merge,Garmin D2 Delta,"Enormt udvalg af urremme til Garmin D2 Delta . Vi har helt sikkert en rem, som du kan bruge.",all conditions,Tag,Equals,Garmin D2 Delta,Garmin D2 Delta Urremme | Mega Udvalg af remme til Garmin D2 Delta,Stort Sortiment af Garmin D2 Delta Urremme. Hurtig Levering. Bedste udvalg og høj service. Find din nye rem i dag.,,
garmin-descent,Merge,Garmin Descent,"Find en ny Garmin Descent rem i dag, eller få et ekstra, så du kan skifte imellem forskellige. En urrem kan give dit smartwatch et helt nyt look, og matche din egen personlige stil.",all conditions,Tag,Equals,Garmin Descent,"Garmin Descent Remme | Remme & Tilbehør - Fri Fragt over 199,-","Alle slags Garmin Descent Urremme. Danmarks Største Udvalg. Gratis Levering ved køb over 199,-",,
garmin-descent-g1,Merge,Garmin Descent G1,Gør dit Garmin Descent G1 ur mere personlig med et ny rem. Vi har et stort udvalg af alle slags urremme med perfekt pasform.,all conditions,Tag,Equals,Garmin Descent G1,Garmin Descent G1 Remme | Køb ny rem til Garmin Descent G1 Her,Stort udvalg af remme til Garmin Descent G1. Danmarks Største udvalg af Smartwatch urremme. Vi sender inden kl. 15 i dag.,,
garmin-descent-mk1,Merge,Garmin Descent MK1,"Her kan du finde en ny Garmin Descent MK1 urrem. Du er heldigvis landet på danmarks største udvalg af smartwatch remme, så du kan helt sikkert finde noget du kan bruge.",all conditions,Tag,Equals,Garmin Descent MK1,"Garmin Descent MK1 Remme | Giga Udvalg - Fri Fragt over 199,-","Uremme til Garmin Descent MK1 hos Danmarks Største Udvalg. Bestil inden. Kl 15 og vi sender i Dag. Køb for mere end 199,- og du får Gratis Fragt.",,
garmin-descent-mk2,Merge,Garmin Descent Mk2,"Vi har altid den urrem, som du mangler til Garmin Descent Mk2. Bestiller du får mere end 199kr, så <b>betaler vi fragten</b>. Så fyld kurven op! Går du til kassen inden kl. 15, så sender vi din ordre afsted samme dag.",all conditions,Tag,Equals,Garmin Descent Mk2,Garmin Descent Mk2 Urremme | Find en ny rem til Garmin Descent Mk2 Her,Ny Garmin Descent Mk2 rem? Så er dette stedet for dig! Vi har det største udvalg i Danmark. Hurtig Levering.,,
garmin-descent-mk2i,Merge,Garmin Descent Mk2i,"De bedste urremme til Garmin Descent Mk2i. Mangler du en ny rem til løbeturen eller når du skal til møde? Vi tilbyder alle slags remme, der passer til dig og dit smartwatch. <b>Gratis Fragt</b> ved køb for mere end 199kr.",all conditions,Tag,Equals,Garmin Descent Mk2i,Garmin Descent Mk2i Remme | Kæmpestort Udvalg af Remme til Garmin Descent Mk2i,"Uremme der passer perfekt til Garmin Descent Mk2i. Vores lager er fyldt med flotte remme til ganske få kroner. Køber du for mere end 199kroner, betaler vi fragten.",,
garmin-descent-mk2s-43mm,Merge,Garmin Descent Mk2S 43mm,"Her kan du finde en ny Garmin Descent Mk2S 43mm urrem. Du er heldigvis landet på danmarks største udvalg af smartwatch remme, så du kan helt sikkert finde noget du kan bruge.",all conditions,Tag,Equals,Garmin Descent Mk2S 43mm,"Garmin Descent Mk2S 43mm Remme | Hurtig & Fri Fragt over 199,-",Er det på tide at udskifte din Garmin Descent Mk2S 43mm rem? Her kan du købe en nye til få penge. Vi sender inden kl. 15,,
garmin-edge,Merge,Garmin Edge,Mangler du en elegant eller behagelig Garmin Edge urrem? Så er du heldig at du er landet hos os! Hos urrem.dk finder du Danmarks Største Udvalg af Garmin Edge remme.,all conditions,Tag,Equals,Garmin Edge,Garmin Edge Remme | Mægtigt Sortiment,"Uremme der passer perfekt til Garmin Edge. Vores lager er fyldt med flotte remme til ganske få kroner. Køber du for mere end 199kroner, betaler vi fragten.",,
garmin-edge-1000,Merge,Garmin Edge 1000,"Leder du efter en ny Garmin Edge 1000 urrem? Så er du kommet til det rigtige sted! Vi har et hav af remme. Du finder <b>Danmarks største udvalg</b>, til at priser der er til at betale. Køb netop den rem, der passer perfekt ind til din livsstil. Husk at fylder du kurven for mere end 199KR, så betaler vi forsendelsen.",all conditions,Tag,Equals,Garmin Edge 1000,Garmin Edge 1000 Tilbehør | Mægtigt Sortiment,"Mangler du en ny Garmin Edge 1000 urrem? Her finder du et stort udvalg af alle slags remme. GRATIS fragt ved køb over 199,-",,
garmin-edge-1030,Merge,Garmin Edge 1030,Mangler du en elegant eller behagelig Garmin Edge 1030 urrem? Så er du heldig at du er landet hos os! Hos urrem.dk finder du Danmarks Største Udvalg af Garmin Edge 1030 remme.,all conditions,Tag,Equals,Garmin Edge 1030,"Garmin Edge 1030 Tilbehør | Bedste Udvalg - Fri Fragt over 199,-","Alle slags Garmin Edge 1030 Urremme. Danmarks Største Udvalg. Gratis Levering ved køb over 199,-",,
garmin-edge-1030-plus,Merge,Garmin Edge 1030 Plus,"Find en ny Garmin Edge 1030 Plus rem i dag, eller få et ekstra, så du kan skifte imellem forskellige. En urrem kan give dit smartwatch et helt nyt look, og matche din egen personlige stil.",all conditions,Tag,Equals,Garmin Edge 1030 Plus,Garmin Edge 1030 Plus Urremme | Køb ny Urrem til Garmin Edge 1030 Plus Her,"Velkommen til et hav af Garmin Edge 1030 Plus Urremme. Bestil inden kl. 15 og vi sender samme dag. Fri Fragt ved køb over 199,-",,
garmin-edge-1040,Merge,Garmin Edge 1040,"Har du brug for en Garmin Edge 1040 urrem, så er du landet på det helt rigtige sted. Vi har et kæmpe udvalg af remme i forskellige farver og materialer.",all conditions,Tag,Equals,Garmin Edge 1040,Garmin Edge 1040 Urremme | Mægtigt Udvalg af Urremme til Garmin Edge 1040,Stort udvalg af remme til Garmin Edge 1040. Danmarks Største udvalg af Smartwatch urremme. Vi sender inden kl. 15 i dag.,,
garmin-edge-130,Merge,Garmin Edge 130,"Vi har altid den urrem, som du mangler til Garmin Edge 130. Bestiller du får mere end 199kr, så <b>betaler vi fragten</b>. Så fyld kurven op! Går du til kassen inden kl. 15, så sender vi din ordre afsted samme dag.",all conditions,Tag,Equals,Garmin Edge 130,Garmin Edge 130 Remme | Største Udvalg i Danmark,Ny Garmin Edge 130 rem? Så er dette stedet for dig! Vi har det største udvalg i Danmark. Hurtig Levering.,,
garmin-edge-200,Merge,Garmin Edge 200,"Vi har altid den urrem, som du mangler til Garmin Edge 200. Bestiller du får mere end 199kr, så <b>betaler vi fragten</b>. Så fyld kurven op! Går du til kassen inden kl. 15, så sender vi din ordre afsted samme dag.",all conditions,Tag,Equals,Garmin Edge 200,"Garmin Edge 200 Remme | Gratis Levering over 199,-",Lækre remme til Garmin Edge 200. Kæmpe Udvalg. Hurtig Levering og FRI Fragt over 199kr.,,
garmin-edge-25,Merge,Garmin Edge 25,"Vi har altid den urrem, som du mangler til Garmin Edge 25. Bestiller du får mere end 199kr, så <b>betaler vi fragten</b>. Så fyld kurven op! Går du til kassen inden kl. 15, så sender vi din ordre afsted samme dag.",all conditions,Tag,Equals,Garmin Edge 25,Garmin Edge 25 Remme | Bedste Udvalg i Danmark,Ny Garmin Edge 25 rem? Så er dette stedet for dig! Vi har det største udvalg i Danmark. Hurtig Levering.,,
garmin-edge-500,Merge,Garmin Edge 500,"Enormt udvalg af urremme til Garmin Edge 500 . Vi har helt sikkert en rem, som du kan bruge.",all conditions,Tag,Equals,Garmin Edge 500,Garmin Edge 500 Urremme | Mægtigt Udvalg af Urremme til Garmin Edge 500,Stort udvalg af remme til Garmin Edge 500. Danmarks Største udvalg af Smartwatch urremme. Vi sender inden kl. 15 i dag.,,
garmin-edge-510,Merge,Garmin Edge 510,"Stort udvalg af Garmin Edge 510 urremme. Hvis din stil er sporty eller klassisk, så kan du med garanti finde en urrem, der passer netop dig. Bestil inden. kl. 15 og vi sender hjem til dig i dag.",all conditions,Tag,Equals,Garmin Edge 510,Garmin Edge 510 Remme | Enormt Udvalg,"Uremme til Garmin Edge 510 hos Danmarks Største Udvalg. Bestil inden. Kl 15 og vi sender i Dag. Køb for mere end 199,- og du får Gratis Fragt.",,
garmin-edge-520,Merge,Garmin Edge 520,"Find en ny Garmin Edge 520 rem i dag, eller få et ekstra, så du kan skifte imellem forskellige. En urrem kan give dit smartwatch et helt nyt look, og matche din egen personlige stil.",all conditions,Tag,Equals,Garmin Edge 520,Garmin Edge 520 Urremme | Bedste Udvalg Remme til Garmin Edge 520,"Uremme der passer perfekt til Garmin Edge 520. Vores lager er fyldt med flotte remme til ganske få kroner. Køber du for mere end 199kroner, betaler vi fragten.",,
garmin-edge-530,Merge,Garmin Edge 530,Gør dit Garmin Edge 530 ur mere personlig med et ny rem. Vi har et stort udvalg af alle slags urremme med perfekt pasform.,all conditions,Tag,Equals,Garmin Edge 530,Garmin Edge 530 Urremme | Stort Sortiment af Remme til Garmin Edge 530,Stort udvalg af remme til Garmin Edge 530. Danmarks Største udvalg af Smartwatch urremme. Vi sender inden kl. 15 i dag.,,
garmin-edge-800-810,Merge,Garmin Edge 800 / 810,Mangler du en ny Garmin Edge 800 / 810 urrem? Så kan vi hjælpe dig. Vi har det største udvalg af urremme i Danmark.,all conditions,Tag,Equals,Garmin Edge 800 / 810,Garmin Edge 800 / 810 Remme | Find en ny Urrem til Garmin Edge 800 / 810 Her,"Alle slags Garmin Edge 800 / 810 Urremme. Danmarks Største Udvalg. Gratis Levering ved køb over 199,-",,
garmin-edge-820,Merge,Garmin Edge 820,"Leder du efter en ny Garmin Edge 820 urrem? Så er du kommet til det rigtige sted! Vi har et hav af remme. Du finder <b>Danmarks største udvalg</b>, til at priser der er til at betale. Køb netop den rem, der passer perfekt ind til din livsstil. Husk at fylder du kurven for mere end 199KR, så betaler vi forsendelsen.",all conditions,Tag,Equals,Garmin Edge 820,Garmin Edge 820 Remme | Find en ny Urrem til Garmin Edge 820 Her,Lækre remme til Garmin Edge 820. Kæmpe Udvalg. Hurtig Levering og FRI Fragt over 199kr.,,
garmin-edge-830,Merge,Garmin Edge 830,"Stort udvalg af Garmin Edge 830 urremme. Hvis din stil er sporty eller klassisk, så kan du med garanti finde en urrem, der passer netop dig. Bestil inden. kl. 15 og vi sender hjem til dig i dag.",all conditions,Tag,Equals,Garmin Edge 830,"Garmin Edge 830 Remme | Hurtig & Gratis Levering over 199,-","Uremme der passer perfekt til Garmin Edge 830. Vores lager er fyldt med flotte remme til ganske få kroner. Køber du for mere end 199kroner, betaler vi fragten.",,
garmin-edge-g80,Merge,Garmin Edge G80,"Leder du efter en ny Garmin Edge G80 urrem? Så er du kommet til det rigtige sted! Vi har et hav af remme. Du finder <b>Danmarks største udvalg</b>, til at priser der er til at betale. Køb netop den rem, der passer perfekt ind til din livsstil. Husk at fylder du kurven for mere end 199KR, så betaler vi forsendelsen.",all conditions,Tag,Equals,Garmin Edge G80,Garmin Edge G80 Remme | Mægtigt Udvalg af Urremme til Garmin Edge G80,Er det på tide at udskifte din Garmin Edge G80 rem? Her kan du købe en nye til få penge. Vi sender inden kl. 15,,
garmin-enduro,Merge,Garmin Enduro,"De bedste urremme til Garmin Enduro. Mangler du en ny rem til løbeturen eller når du skal til møde? Vi tilbyder alle slags remme, der passer til dig og dit smartwatch. <b>Gratis Fragt</b> ved køb for mere end 199kr.",all conditions,Tag,Equals,Garmin Enduro,"Garmin Enduro Rem | Fri Levering over 199,-","Uremme til Garmin Enduro hos Danmarks Største Udvalg. Bestil inden. Kl 15 og vi sender i Dag. Køb for mere end 199,- og du får Gratis Fragt.",,
garmin-epix,Merge,Garmin Epix,"Leder du efter en ny Garmin Epix urrem? Så er du kommet til det rigtige sted! Vi har et hav af remme. Du finder <b>Danmarks største udvalg</b>, til at priser der er til at betale. Køb netop den rem, der passer perfekt ind til din livsstil. Husk at fylder du kurven for mere end 199KR, så betaler vi forsendelsen.",all conditions,Tag,Equals,Garmin Epix,Garmin Epix Remme | Bedste Sortiment af Remme til Garmin Epix,Ny Garmin Epix rem? Så er dette stedet for dig! Vi har det største udvalg i Danmark. Hurtig Levering.,,
garmin-epix-gen-2,Merge,Garmin Epix Gen 2,"Her har du hele vores udvalg af remme til Garmin Epix Gen 2. Med en ny urrem kan du gøre dit smartwatch mere personlig. De er nemme at udskifte, så du kan også fylde skuffen med forskellige urremme og udskifte dem efter behov. Køber du får mere end 199,- så leverer vi kvit og frit.",all conditions,Tag,Equals,Garmin Epix Gen 2,"Garmin Epix Gen 2 Urremme | Stort Vareudvalg - Fri Fragt over 199,-","Mangler du en ny Garmin Epix Gen 2 urrem? Her finder du et stort udvalg af alle slags remme. GRATIS fragt ved køb over 199,-",,
garmin-etrex,Merge,Garmin Etrex,"Har du brug for en Garmin Etrex urrem, så er du landet på det helt rigtige sted. Vi har et kæmpe udvalg af remme i forskellige farver og materialer.",all conditions,Tag,Equals,Garmin Etrex,Garmin Etrex Remme | Mægtigt Sortiment af Remme til Garmin Etrex,"Uremme der passer perfekt til Garmin Etrex. Vores lager er fyldt med flotte remme til ganske få kroner. Køber du for mere end 199kroner, betaler vi fragten.",,
garmin-etrex-10,Merge,Garmin eTrex 10,Gør dit Garmin eTrex 10 ur mere personlig med et ny rem. Vi har et stort udvalg af alle slags urremme med perfekt pasform.,all conditions,Tag,Equals,Garmin eTrex 10,Garmin eTrex 10 Urremme | Stort Sortiment af Urremme til Garmin eTrex 10,"Kæmpe Udvalg af Garmin eTrex 10 Urremme. Køb for 199,- og vi betaler Fragten. Hurtigt Service. Danmarks Største Udvalg af Remme.",,
garmin-etrex-20,Merge,Garmin eTrex 20,Er det på tide at udskifte remmen? Du finder et vælg af <b>Garmin eTrex 20 urremme</b> her hos Danmarks største udvalg.,all conditions,Tag,Equals,Garmin eTrex 20,Garmin eTrex 20 Remme | Største Udvalg i Danmark,Er det på tide at udskifte din Garmin eTrex 20 rem? Her kan du købe en nye til få penge. Vi sender inden kl. 15,,
garmin-etrex-201x,Merge,Garmin eTrex 201x,"Her kan du finde en ny Garmin eTrex 201x urrem. Du er heldigvis landet på danmarks største udvalg af smartwatch remme, så du kan helt sikkert finde noget du kan bruge.",all conditions,Tag,Equals,Garmin eTrex 201x,"Garmin eTrex 201x Remme | Hurtig & Fri Fragt over 199,-","Velkommen til et hav af Garmin eTrex 201x Urremme. Bestil inden kl. 15 og vi sender samme dag. Fri Fragt ved køb over 199,-",,
garmin-etrex-209x,Merge,Garmin eTrex 209x,Mangler du en ny Garmin eTrex 209x urrem? Så kan vi hjælpe dig. Vi har det største udvalg af urremme i Danmark.,all conditions,Tag,Equals,Garmin eTrex 209x,Garmin eTrex 209x Urremme | Køb ny rem til Garmin eTrex 209x Her,Stort udvalg af remme til Garmin eTrex 209x. Danmarks Største udvalg af Smartwatch urremme. Vi sender inden kl. 15 i dag.,,
garmin-etrex-20x,Merge,Garmin eTrex 20x,"Enormt udvalg af urremme til Garmin eTrex 20x . Vi har helt sikkert en rem, som du kan bruge.",all conditions,Tag,Equals,Garmin eTrex 20x,Garmin eTrex 20x Urremme | Bedste Udvalg Remme til Garmin eTrex 20x,"Alle slags Garmin eTrex 20x Urremme. Danmarks Største Udvalg. Gratis Levering ved køb over 199,-",,
garmin-etrex-22x,Merge,Garmin eTrex 22x,"Leder du efter en ny Garmin eTrex 22x urrem? Så er du kommet til det rigtige sted! Vi har et hav af remme. Du finder <b>Danmarks største udvalg</b>, til at priser der er til at betale. Køb netop den rem, der passer perfekt ind til din livsstil. Husk at fylder du kurven for mere end 199KR, så betaler vi forsendelsen.",all conditions,Tag,Equals,Garmin eTrex 22x,"Garmin eTrex 22x Urremme | Bedste Udvalg - Fri Fragt over 199,-",Er det på tide at udskifte din Garmin eTrex 22x rem? Her kan du købe en nye til få penge. Vi sender inden kl. 15,,
garmin-etrex-30,Merge,Garmin eTrex 30,Danmarks Bedste Udvalg af Garmin eTrex 30 urremme. Den rem du leder efter finder du her på siden. Vi har i mange forskellige materialer og stilarter. Find den urrem du mangler i dag!,all conditions,Tag,Equals,Garmin eTrex 30,"Garmin eTrex 30 Remme | Fri Fragt over 199,-","Velkommen til et hav af Garmin eTrex 30 Urremme. Bestil inden kl. 15 og vi sender samme dag. Fri Fragt ved køb over 199,-",,
garmin-etrex-309x,Merge,Garmin eTrex 309x,Mangler du en ny Garmin eTrex 309x urrem? Så kan vi hjælpe dig. Vi har det største udvalg af urremme i Danmark.,all conditions,Tag,Equals,Garmin eTrex 309x,Garmin eTrex 309x Urremme | Største Udvalg i Danmark,Er det på tide at udskifte din Garmin eTrex 309x rem? Her kan du købe en nye til få penge. Vi sender inden kl. 15,,
garmin-etrex-30x,Merge,Garmin eTrex 30x,Er det på tide at udskifte remmen? Du finder et vælg af <b>Garmin eTrex 30x urremme</b> her hos Danmarks største udvalg.,all conditions,Tag,Equals,Garmin eTrex 30x,Garmin eTrex 30x Remme | Gigantisk Udvalg af Remme til Garmin eTrex 30x,"Velkommen til et hav af Garmin eTrex 30x Urremme. Bestil inden kl. 15 og vi sender samme dag. Fri Fragt ved køb over 199,-",,
garmin-etrex-32x,Merge,Garmin eTrex 32x,"Skal du bruge en ny Garmin eTrex 32x urrem til enten træning eller hverdagen, så har vi heldigvis et hav af forskellige remme, som du kan vælge imellem.",all conditions,Tag,Equals,Garmin eTrex 32x,Garmin eTrex 32x Urremme | Stort Udvalg,Stort udvalg af remme til Garmin eTrex 32x. Danmarks Største udvalg af Smartwatch urremme. Vi sender inden kl. 15 i dag.,,
garmin-fenix,Merge,Garmin Fenix,Gør dit Garmin Fenix ur mere personlig med et ny rem. Vi har et stort udvalg af alle slags urremme med perfekt pasform.,all conditions,Tag,Equals,Garmin Fenix,"Garmin Fenix Rem | Gratis Levering over 199,-","Uremme der passer perfekt til Garmin Fenix. Vores lager er fyldt med flotte remme til ganske få kroner. Køber du for mere end 199kroner, betaler vi fragten.",,
garmin-fenix-3,Merge,Garmin Fenix 3,"Har du brug for en Garmin Fenix 3 urrem, så er du landet på det helt rigtige sted. Vi har et kæmpe udvalg af remme i forskellige farver og materialer.",all conditions,Tag,Equals,Garmin Fenix 3,Garmin Fenix 3 Rem | Enormt Udvalg af Urremme til Garmin Fenix 3,Er det på tide at udskifte din Garmin Fenix 3 rem? Her kan du købe en nye til få penge. Vi sender inden kl. 15,,
garmin-fenix-5,Merge,Garmin Fenix 5,"Find en ny Garmin Fenix 5 rem i dag, eller få et ekstra, så du kan skifte imellem forskellige. En urrem kan give dit smartwatch et helt nyt look, og matche din egen personlige stil.",all conditions,Tag,Equals,Garmin Fenix 5,Garmin Fenix 5 Rem | Bedste Sortiment af Urremme til Garmin Fenix 5,Stort Sortiment af Garmin Fenix 5 Urremme. Hurtig Levering. Bedste udvalg og høj service. Find din nye rem i dag.,,
garmin-fenix-5-plus,Merge,Garmin Fenix 5 Plus,"Velkommen til et godt udvalg af Garmin Fenix 5 Plus urremme. Fylder du kurven for mere end 199kroner, så får du <b>gratis levering.</b>.",all conditions,Tag,Equals,Garmin Fenix 5 Plus,Rem Til Garmin Fenix 5 Plus | Enormt Udvalg,Ny Garmin Fenix 5 Plus rem? Så er dette stedet for dig! Vi har det største udvalg i Danmark. Hurtig Levering.,,
garmin-fenix-5s,Merge,Garmin Fenix 5S,Er det på tide at udskifte remmen? Du finder et vælg af <b>Garmin Fenix 5S urremme</b> her hos Danmarks største udvalg.,all conditions,Tag,Equals,Garmin Fenix 5S,Garmin Fenix 5s Rem | Stort Udvalg,"Alle slags Garmin Fenix 5S Urremme. Danmarks Største Udvalg. Gratis Levering ved køb over 199,-",,
garmin-fenix-5s-plus,Merge,Garmin Fenix 5S Plus,Gør dit Garmin Fenix 5S Plus ur mere personlig med et ny rem. Vi har et stort udvalg af alle slags urremme med perfekt pasform.,all conditions,Tag,Equals,Garmin Fenix 5S Plus,Rem Til Garmin Fenix 5s Plus | Mega Udvalg af remme til Garmin Fenix 5S Plus,Ny Garmin Fenix 5S Plus rem? Så er dette stedet for dig! Vi har det største udvalg i Danmark. Hurtig Levering.,,
garmin-fenix-5x,Merge,Garmin Fenix 5X,Gør dit Garmin Fenix 5X ur mere personlig med et ny rem. Vi har et stort udvalg af alle slags urremme med perfekt pasform.,all conditions,Tag,Equals,Garmin Fenix 5X,Garmin Fenix 5x Rem | Bedste Sortiment af Urremme til Garmin Fenix 5X,Stort Sortiment af Garmin Fenix 5X Urremme. Hurtig Levering. Bedste udvalg og høj service. Find din nye rem i dag.,,
garmin-fenix-5x-plus,Merge,Garmin Fenix 5X Plus,"Har du brug for en Garmin Fenix 5X Plus urrem, så er du landet på det helt rigtige sted. Vi har et kæmpe udvalg af remme i forskellige farver og materialer.",all conditions,Tag,Equals,Garmin Fenix 5X Plus,"Rem Til Garmin Fenix 5x Plus | Fri Fragt over 199,-","Kæmpe Udvalg af Garmin Fenix 5X Plus Urremme. Køb for 199,- og vi betaler Fragten. Hurtigt Service. Danmarks Største Udvalg af Remme.",,
