Handle,Command,Title,Body HTML,Must Match,Rule: Product Column,Rule: Relation,Rule: Condition,Metafield: title_tag [string],Metafield: description_tag [string],Template Suffix,Metafield: custom.belongs_to [single_line_text_field]
garmin-vivosmart,Merge,Garmin Vivosmart,"Velkommen til et godt udvalg af Garmin Vivosmart urremme. Fylder du kurven for mere end 199kroner, så får du <b>gratis levering.</b>.",all conditions,Tag,Equals,Garmin Vivosmart,Garmin Vivosmart Remme | Stort Sortiment af Remme til Garmin Vivosmart,"Kæmpe Udvalg af Garmin Vivosmart Urremme. Køb for 199,- og vi betaler Fragten. Hurtigt Service. Danmarks Største Udvalg af Remme.",,
garmin-vivosmart-3,Merge,Garmin Vivosmart 3,Mangler du en elegant eller behagelig Garmin Vivosmart 3 urrem? Så er du heldig at du er landet hos os! Hos urrem.dk finder du Danmarks Største Udvalg af Garmin Vivosmart 3 remme.,all conditions,Tag,Equals,Garmin Vivosmart 3,"Garmin Vivosmart 3 Remme | Bedste Udvalg - Fri Fragt over 199,-",Ny Garmin Vivosmart 3 rem? Så er dette stedet for dig! Vi har det største udvalg i Danmark. Hurtig Levering.,,
garmin-vivosmart-4,Merge,Garmin Vivosmart 4,"Vi har altid den urrem, som du mangler til Garmin Vivosmart 4. Bestiller du får mere end 199kr, så <b>betaler vi fragten</b>. Så fyld kurven op! Går du til kassen inden kl. 15, så sender vi din ordre afsted samme dag.",all conditions,Tag,Equals,Garmin Vivosmart 4,Garmin Vivosmart 4 Remme | Mægtigt Udvalg,Er det på tide at udskifte din Garmin Vivosmart 4 rem? Her kan du købe en nye til få penge. Vi sender inden kl. 15,,
garmin-vivosmart-5,Merge,Garmin Vivosmart 5,Mangler du en elegant eller behagelig Garmin Vivosmart 5 urrem? Så er du heldig at du er landet hos os! Hos urrem.dk finder du Danmarks Største Udvalg af Garmin Vivosmart 5 remme.,all conditions,Tag,Equals,Garmin Vivosmart 5,Garmin Vivosmart 5 Remme | Bedste Udvalg i Danmark,"Uremme til Garmin Vivosmart 5 hos Danmarks Største Udvalg. Bestil inden. Kl 15 og vi sender i Dag. Køb for mere end 199,- og du får Gratis Fragt.",,
garmin-vivosmart-hr,Merge,Garmin Vivosmart HR,"Har du brug for en Garmin Vivosmart HR urrem, så er du landet på det helt rigtige sted. Vi har et kæmpe udvalg af remme i forskellige farver og materialer.",all conditions,Tag,Equals,Garmin Vivosmart HR,"Rem Til Garmin Vivosmart Hr | Hurtig & Gratis Levering over 199,-","Alle slags Garmin Vivosmart HR Urremme. Danmarks Største Udvalg. Gratis Levering ved køb over 199,-",,
garmin-vivosmart-hr,Merge,Garmin Vivosmart HR+,Er det på tide at udskifte remmen? Du finder et vælg af <b>Garmin Vivosmart HR+ urremme</b> her hos Danmarks største udvalg.,all conditions,Tag,Equals,Garmin Vivosmart HR+,Garmin Vivosmart HR+ Remme | Bedste Udvalg Remme til Garmin Vivosmart HR+,"Mangler du en ny Garmin Vivosmart HR+ urrem? Her finder du et stort udvalg af alle slags remme. GRATIS fragt ved køb over 199,-",,
garmin-vivosport,Merge,Garmin Vivosport,"Her har du hele vores udvalg af remme til Garmin Vivosport. Med en ny urrem kan du gøre dit smartwatch mere personlig. De er nemme at udskifte, så du kan også fylde skuffen med forskellige urremme og udskifte dem efter behov. Køber du får mere end 199,- så leverer vi kvit og frit.",all conditions,Tag,Equals,Garmin Vivosport,Rem Til Garmin Vivosport | Stort Sortiment af Urremme til Garmin Vivosport,Er det på tide at udskifte din Garmin Vivosport rem? Her kan du købe en nye til få penge. Vi sender inden kl. 15,,
gulfbuddy-voice-2-gps,Merge,GulfBuddy Voice 2 GPS,Gør dit GulfBuddy Voice 2 GPS ur mere personlig med et ny rem. Vi har et stort udvalg af alle slags urremme med perfekt pasform.,all conditions,Tag,Equals,GulfBuddy Voice 2 GPS,"GulfBuddy Voice 2 GPS Urremme | Hurtig & Fri Fragt over 199,-",Ny GulfBuddy Voice 2 GPS rem? Så er dette stedet for dig! Vi har det største udvalg i Danmark. Hurtig Levering.,,
gulfbuddy-voice-gps,Merge,GulfBuddy Voice GPS,"Velkommen til et godt udvalg af GulfBuddy Voice GPS urremme. Fylder du kurven for mere end 199kroner, så får du <b>gratis levering.</b>.",all conditions,Tag,Equals,GulfBuddy Voice GPS,GulfBuddy Voice GPS Urremme | Køb ny rem til GulfBuddy Voice GPS Her,Stort Sortiment af GulfBuddy Voice GPS Urremme. Hurtig Levering. Bedste udvalg og høj service. Find din nye rem i dag.,,
haylou,Merge,Haylou,Er det på tide at udskifte remmen? Du finder et vælg af <b>Haylou urremme</b> her hos Danmarks største udvalg.,all conditions,Tag,Equals,Haylou,"Haylou Urremme | Stort Udvalg - Fri Fragt over 199,-",Er det på tide at udskifte din Haylou rem? Her kan du købe en nye til få penge. Vi sender inden kl. 15,,
haylou-gs,Merge,Haylou GS,"Velkommen til et godt udvalg af Haylou GS urremme. Fylder du kurven for mere end 199kroner, så får du <b>gratis levering.</b>.",all conditions,Tag,Equals,Haylou GS,Haylou GS Urremme | Køb en Erstatningsrem til Haylou GS Her,Ny Haylou GS rem? Så er dette stedet for dig! Vi har det største udvalg i Danmark. Hurtig Levering.,,
haylou-gst-ls09b,Merge,Haylou GST LS09B,"Her kan du finde en ny Haylou GST LS09B urrem. Du er heldigvis landet på danmarks største udvalg af smartwatch remme, så du kan helt sikkert finde noget du kan bruge.",all conditions,Tag,Equals,Haylou GST LS09B,"Haylou GST LS09B Remme | Fri Levering over 199,-","Mangler du en ny Haylou GST LS09B urrem? Her finder du et stort udvalg af alle slags remme. GRATIS fragt ved køb over 199,-",,
haylou-ls04-solar,Merge,Haylou LS04 Solar,Danmarks Bedste Udvalg af Haylou LS04 Solar urremme. Den rem du leder efter finder du her på siden. Vi har i mange forskellige materialer og stilarter. Find den urrem du mangler i dag!,all conditions,Tag,Equals,Haylou LS04 Solar,Haylou LS04 Solar Urremme | Stort Udvalg,"Velkommen til et hav af Haylou LS04 Solar Urremme. Bestil inden kl. 15 og vi sender samme dag. Fri Fragt ved køb over 199,-",,
haylou-rs3,Merge,Haylou RS3,"Stort udvalg af Haylou RS3 urremme. Hvis din stil er sporty eller klassisk, så kan du med garanti finde en urrem, der passer netop dig. Bestil inden. kl. 15 og vi sender hjem til dig i dag.",all conditions,Tag,Equals,Haylou RS3,Haylou RS3 Remme | Bedste Udvalg,Ny Haylou RS3 rem? Så er dette stedet for dig! Vi har det største udvalg i Danmark. Hurtig Levering.,,
haylou-rs4-plus,Merge,Haylou RS4 Plus,Mangler du en ny Haylou RS4 Plus urrem? Så kan vi hjælpe dig. Vi har det største udvalg af urremme i Danmark.,all conditions,Tag,Equals,Haylou RS4 Plus,Haylou RS4 Plus Remme | Enormt Udvalg,"Uremme til Haylou RS4 Plus hos Danmarks Største Udvalg. Bestil inden. Kl 15 og vi sender i Dag. Køb for mere end 199,- og du får Gratis Fragt.",,
haylou-rt-ls05s,Merge,Haylou RT LS05S,"Stort udvalg af Haylou RT LS05S urremme. Hvis din stil er sporty eller klassisk, så kan du med garanti finde en urrem, der passer netop dig. Bestil inden. kl. 15 og vi sender hjem til dig i dag.",all conditions,Tag,Equals,Haylou RT LS05S,Haylou RT LS05S Urremme | Kæmpestort Udvalg,"Alle slags Haylou RT LS05S Urremme. Danmarks Største Udvalg. Gratis Levering ved køb over 199,-",,
haylou-rt2-ls10,Merge,Haylou RT2 (LS10),Mangler du en ny Haylou RT2 (LS10) urrem? Så kan vi hjælpe dig. Vi har det største udvalg af urremme i Danmark.,all conditions,Tag,Equals,Haylou RT2 (LS10),Haylou RT2 (LS10) Urremme | Køb ny Urrem til Haylou RT2 (LS10) Her,"Mangler du en ny Haylou RT2 (LS10) urrem? Her finder du et stort udvalg af alle slags remme. GRATIS fragt ved køb over 199,-",,
haylou-smartwatch,Merge,Haylou SmartWatch,"Har du brug for en Haylou SmartWatch urrem, så er du landet på det helt rigtige sted. Vi har et kæmpe udvalg af remme i forskellige farver og materialer.",all conditions,Tag,Equals,Haylou SmartWatch,"Haylou SmartWatch Urremme | Fri Levering over 199,-",Er det på tide at udskifte din Haylou SmartWatch rem? Her kan du købe en nye til få penge. Vi sender inden kl. 15,,
haylou-smartwatch-ls01,Merge,Haylou SmartWatch LS01,"Stort udvalg af Haylou SmartWatch LS01 urremme. Hvis din stil er sporty eller klassisk, så kan du med garanti finde en urrem, der passer netop dig. Bestil inden. kl. 15 og vi sender hjem til dig i dag.",all conditions,Tag,Equals,Haylou SmartWatch LS01,Haylou SmartWatch LS01 Urremme | Største Udvalg i Danmark,"Uremme til Haylou SmartWatch LS01 hos Danmarks Største Udvalg. Bestil inden. Kl 15 og vi sender i Dag. Køb for mere end 199,- og du får Gratis Fragt.",,
haylou-smartwatch-ls02,Merge,Haylou SmartWatch LS02,"Velkommen til et godt udvalg af Haylou SmartWatch LS02 urremme. Fylder du kurven for mere end 199kroner, så får du <b>gratis levering.</b>.",all conditions,Tag,Equals,Haylou SmartWatch LS02,"Haylou SmartWatch LS02 Remme | Stort Vareudvalg - Fri Fragt over 199,-",Ny Haylou SmartWatch LS02 rem? Så er dette stedet for dig! Vi har det største udvalg i Danmark. Hurtig Levering.,,
haylou-smartwatch-rs4,Merge,Haylou Smartwatch RS4,"Her kan du finde en ny Haylou Smartwatch RS4 urrem. Du er heldigvis landet på danmarks største udvalg af smartwatch remme, så du kan helt sikkert finde noget du kan bruge.",all conditions,Tag,Equals,Haylou Smartwatch RS4,"Haylou Smartwatch RS4 Urremme | Bedste Udvalg - Fri Fragt over 199,-","Mangler du en ny Haylou Smartwatch RS4 urrem? Her finder du et stort udvalg af alle slags remme. GRATIS fragt ved køb over 199,-",,
haylou-solar,Merge,Haylou Solar,"Velkommen til et godt udvalg af Haylou Solar urremme. Fylder du kurven for mere end 199kroner, så får du <b>gratis levering.</b>.",all conditions,Tag,Equals,Haylou Solar,"Haylou Solar Remme | Gratis Fragt over 199,-","Uremme der passer perfekt til Haylou Solar. Vores lager er fyldt med flotte remme til ganske få kroner. Køber du for mere end 199kroner, betaler vi fragten.",,
haylou-solar-ls05,Merge,Haylou Solar LS05,"Velkommen til et godt udvalg af Haylou Solar LS05 urremme. Fylder du kurven for mere end 199kroner, så får du <b>gratis levering.</b>.",all conditions,Tag,Equals,Haylou Solar LS05,"Haylou Solar LS05 Urremme | Stort Vareudvalg - Fri Fragt over 199,-",Er det på tide at udskifte din Haylou Solar LS05 rem? Her kan du købe en nye til få penge. Vi sender inden kl. 15,,
honor,Merge,Honor,"Her kan du finde en ny Honor urrem. Du er heldigvis landet på danmarks største udvalg af smartwatch remme, så du kan helt sikkert finde noget du kan bruge.",all conditions,Tag,Equals,Honor,Honor Remme | Bedste Udvalg,"Uremme til Honor hos Danmarks Største Udvalg. Bestil inden. Kl 15 og vi sender i Dag. Køb for mere end 199,- og du får Gratis Fragt.",,
honor-band-series,Merge,Honor Band Series,"Enormt udvalg af urremme til Honor Band Series . Vi har helt sikkert en rem, som du kan bruge.",all conditions,Tag,Equals,Honor Band Series,"Honor Band Series Remme | Gratis Levering over 199,-",Ny Honor Band Series rem? Så er dette stedet for dig! Vi har det største udvalg i Danmark. Hurtig Levering.,parent-collection,
honor-band-3,Merge,Honor Band 3,"Stort udvalg af Honor Band 3 urremme. Hvis din stil er sporty eller klassisk, så kan du med garanti finde en urrem, der passer netop dig. Bestil inden. kl. 15 og vi sender hjem til dig i dag.",all conditions,Tag,Equals,Honor Band 3,"Honor Band 3 Remme | Hurtig & Gratis Levering over 199,-",Stort udvalg af remme til Honor Band 3. Danmarks Største udvalg af Smartwatch urremme. Vi sender inden kl. 15 i dag.,,Honor Band Series
honor-band-5,Merge,Honor Band 5,"Her kan du finde en ny Honor Band 5 urrem. Du er heldigvis landet på danmarks største udvalg af smartwatch remme, så du kan helt sikkert finde noget du kan bruge.",all conditions,Tag,Equals,Honor Band 5,"Honor Band 5 Remme | Remme & Tilbehør - Fri Fragt over 199,-","Kæmpe Udvalg af Honor Band 5 Urremme. Køb for 199,- og vi betaler Fragten. Hurtigt Service. Danmarks Største Udvalg af Remme.",,Honor Band Series
honor-band-5i,Merge,Honor Band 5i,Gør dit Honor Band 5i ur mere personlig med et ny rem. Vi har et stort udvalg af alle slags urremme med perfekt pasform.,all conditions,Tag,Equals,Honor Band 5i,"Honor Band 5i Remme | Hurtig & Fri Fragt over 199,-","Velkommen til et hav af Honor Band 5i Urremme. Bestil inden kl. 15 og vi sender samme dag. Fri Fragt ved køb over 199,-",,Honor Band Series
honor-band-6,Merge,Honor Band 6,"Vi har altid den urrem, som du mangler til Honor Band 6. Bestiller du får mere end 199kr, så <b>betaler vi fragten</b>. Så fyld kurven op! Går du til kassen inden kl. 15, så sender vi din ordre afsted samme dag.",all conditions,Tag,Equals,Honor Band 6,"Honor Band 6 Urremme | Remme & Tilbehør - Fri Fragt over 199,-",Stort Sortiment af Honor Band 6 Urremme. Hurtig Levering. Bedste udvalg og høj service. Find din nye rem i dag.,,Honor Band Series
honor-magicwatch-series,Merge,Honor MagicWatch Series,"Velkommen til et godt udvalg af Honor MagicWatch Series urremme. Fylder du kurven for mere end 199kroner, så får du <b>gratis levering.</b>.",all conditions,Tag,Equals,Honor MagicWatch Series,Honor MagicWatch Series Remme | Køb ny Urrem til Honor MagicWatch Series Her,Stort Sortiment af Honor MagicWatch Series Urremme. Hurtig Levering. Bedste udvalg og høj service. Find din nye rem i dag.,parent-collection,
honor-magicwatch-2-42mm,Merge,Honor MagicWatch 2 42mm,Mangler du en ny Honor MagicWatch 2 42mm urrem? Så kan vi hjælpe dig. Vi har det største udvalg af urremme i Danmark.,all conditions,Tag,Equals,Honor MagicWatch 2 42mm,"Honor MagicWatch 2 42mm Urremme | Hurtig & Fri Levering over 199,-",Er det på tide at udskifte din Honor MagicWatch 2 42mm rem? Her kan du købe en nye til få penge. Vi sender inden kl. 15,,Honor MagicWatch Series
honor-magicwatch-2-46mm,Merge,Honor MagicWatch 2 46mm,Mangler du en ny Honor MagicWatch 2 46mm urrem? Så kan vi hjælpe dig. Vi har det største udvalg af urremme i Danmark.,all conditions,Tag,Equals,Honor MagicWatch 2 46mm,Honor MagicWatch 2 46mm Remme | Stort Sortiment af Urremme til Honor MagicWatch 2 46mm,"Uremme til Honor MagicWatch 2 46mm hos Danmarks Største Udvalg. Bestil inden. Kl 15 og vi sender i Dag. Køb for mere end 199,- og du får Gratis Fragt.",,Honor MagicWatch Series
honor-s1,Merge,Honor S1,"Velkommen til et godt udvalg af Honor S1 urremme. Fylder du kurven for mere end 199kroner, så får du <b>gratis levering.</b>.",all conditions,Tag,Equals,Honor S1,"Honor S1 Urremme | Stort Udvalg - Fri Fragt over 199,-",Er det på tide at udskifte din Honor S1 rem? Her kan du købe en nye til få penge. Vi sender inden kl. 15,,
honor-watch-series,Merge,Honor Watch Series,"Skal du bruge en ny Honor Watch Series urrem til enten træning eller hverdagen, så har vi heldigvis et hav af forskellige remme, som du kan vælge imellem.",all conditions,Tag,Equals,Honor Watch Series,"Honor Watch Series Remme | Fri Levering over 199,-","Mangler du en ny Honor Watch Series urrem? Her finder du et stort udvalg af alle slags remme. GRATIS fragt ved køb over 199,-",parent-collection,
honor-watch-dream,Merge,Honor Watch Dream,"Leder du efter en ny Honor Watch Dream urrem? Så er du kommet til det rigtige sted! Vi har et hav af remme. Du finder <b>Danmarks største udvalg</b>, til at priser der er til at betale. Køb netop den rem, der passer perfekt ind til din livsstil. Husk at fylder du kurven for mere end 199KR, så betaler vi forsendelsen.",all conditions,Tag,Equals,Honor Watch Dream,Honor Watch Dream Remme | Køb en Erstatningsrem til Honor Watch Dream Her,"Uremme til Honor Watch Dream hos Danmarks Største Udvalg. Bestil inden. Kl 15 og vi sender i Dag. Køb for mere end 199,- og du får Gratis Fragt.",,Honor Watch Series
honor-watch-es,Merge,Honor Watch ES,"Vi har altid den urrem, som du mangler til Honor Watch ES. Bestiller du får mere end 199kr, så <b>betaler vi fragten</b>. Så fyld kurven op! Går du til kassen inden kl. 15, så sender vi din ordre afsted samme dag.",all conditions,Tag,Equals,Honor Watch ES,Honor Watch ES Urremme | Bedste Udvalg,"Velkommen til et hav af Honor Watch ES Urremme. Bestil inden kl. 15 og vi sender samme dag. Fri Fragt ved køb over 199,-",,Honor Watch Series
honor-watch-gs-3,Merge,Honor Watch GS 3,"Find en ny Honor Watch GS 3 rem i dag, eller få et ekstra, så du kan skifte imellem forskellige. En urrem kan give dit smartwatch et helt nyt look, og matche din egen personlige stil.",all conditions,Tag,Equals,Honor Watch GS 3,"Honor Watch GS 3 Remme | Hurtig & Fri Levering over 199,-","Uremme der passer perfekt til Honor Watch GS 3. Vores lager er fyldt med flotte remme til ganske få kroner. Køber du for mere end 199kroner, betaler vi fragten.",,Honor Watch Series
honor-watch-gs-pro,Merge,Honor Watch GS Pro,"Stort udvalg af Honor Watch GS Pro urremme. Hvis din stil er sporty eller klassisk, så kan du med garanti finde en urrem, der passer netop dig. Bestil inden. kl. 15 og vi sender hjem til dig i dag.",all conditions,Tag,Equals,Honor Watch GS Pro,"Honor Watch GS Pro Urremme | Hurtig & Fri Levering over 199,-",Stort Sortiment af Honor Watch GS Pro Urremme. Hurtig Levering. Bedste udvalg og høj service. Find din nye rem i dag.,,Honor Watch Series
huawei,Merge,Huawei,"Vil du gøre dit smartwatch mere personligt? Vi har et stort sortiment af alle slags Huawei urremme, du finder remmene i massevis af farver og materialer. Så kan du finde netop den urrem, som du går og leder efter.",all conditions,Tag,Equals,Huawei,"Huawei Tilbehør | Bedste Udvalg - Fri Fragt over 199,-",Ny Huawei rem? Så er dette stedet for dig! Vi har det største udvalg i Danmark. Hurtig Levering.,,
huawei-band-2,Merge,Huawei Band 2,Danmarks Bedste Udvalg af Huawei Band 2 urremme. Den rem du leder efter finder du her på siden. Vi har i mange forskellige materialer og stilarter. Find den urrem du mangler i dag!,all conditions,Tag,Equals,Huawei Band 2,"Huawei Band 2 Remme | Fri Fragt over 199,-","Alle slags Huawei Band 2 Urremme. Danmarks Største Udvalg. Gratis Levering ved køb over 199,-",,Huawei Band 2 Series
huawei-band-2-pro,Merge,Huawei Band 2 Pro,"Her har du hele vores udvalg af remme til Huawei Band 2 Pro. Med en ny urrem kan du gøre dit smartwatch mere personlig. De er nemme at udskifte, så du kan også fylde skuffen med forskellige urremme og udskifte dem efter behov. Køber du får mere end 199,- så leverer vi kvit og frit.",all conditions,Tag,Equals,Huawei Band 2 Pro,Huawei Band 2 Pro Remme | Lækre Urremme til Huawei Band 2 Pro,Stort Sortiment af Huawei Band 2 Pro Urremme. Hurtig Levering. Bedste udvalg og høj service. Find din nye rem i dag.,,Huawei Band 2 Series
huawei-band-2-series,Merge,Huawei Band 2 Series,Mangler du en elegant eller behagelig Huawei Band 2 Series urrem? Så er du heldig at du er landet hos os! Hos urrem.dk finder du Danmarks Største Udvalg af Huawei Band 2 Series remme.,all conditions,Tag,Equals,Huawei Band 2 Series,Huawei Band 2 Series Remme | Bedste Udvalg,Lækre remme til Huawei Band 2 Series. Kæmpe Udvalg. Hurtig Levering og FRI Fragt over 199kr.,parent-collection,
huawei-band-3,Merge,Huawei Band 3,"Enormt udvalg af urremme til Huawei Band 3 . Vi har helt sikkert en rem, som du kan bruge.",all conditions,Tag,Equals,Huawei Band 3,"Huawei Band 3 Urremme | Hurtig & Gratis Fragt over 199,-",Stort Sortiment af Huawei Band 3 Urremme. Hurtig Levering. Bedste udvalg og høj service. Find din nye rem i dag.,,Huawei Band 3 Series
huawei-band-3-pro,Merge,Huawei Band 3 Pro,"Vi har altid den urrem, som du mangler til Huawei Band 3 Pro. Bestiller du får mere end 199kr, så <b>betaler vi fragten</b>. Så fyld kurven op! Går du til kassen inden kl. 15, så sender vi din ordre afsted samme dag.",all conditions,Tag,Equals,Huawei Band 3 Pro,Huawei Band 3 Pro Urremme | Største Udvalg i Danmark,Ny Huawei Band 3 Pro rem? Så er dette stedet for dig! Vi har det største udvalg i Danmark. Hurtig Levering.,,Huawei Band 3 Series
huawei-band-3-series,Merge,Huawei Band 3 Series,"Stort udvalg af Huawei Band 3 Series urremme. Hvis din stil er sporty eller klassisk, så kan du med garanti finde en urrem, der passer netop dig. Bestil inden. kl. 15 og vi sender hjem til dig i dag.",all conditions,Tag,Equals,Huawei Band 3 Series,Huawei Band 3 Series Urremme | Bedste Udvalg,"Mangler du en ny Huawei Band 3 Series urrem? Her finder du et stort udvalg af alle slags remme. GRATIS fragt ved køb over 199,-",parent-collection,
huawei-band-4-pro,Merge,Huawei Band 4 Pro,"Leder du efter en ny Huawei Band 4 Pro urrem? Så er du kommet til det rigtige sted! Vi har et hav af remme. Du finder <b>Danmarks største udvalg</b>, til at priser der er til at betale. Køb netop den rem, der passer perfekt ind til din livsstil. Husk at fylder du kurven for mere end 199KR, så betaler vi forsendelsen.",all conditions,Tag,Equals,Huawei Band 4 Pro,Huawei Band 4 Pro Remme | Lækre Urremme til Huawei Band 4 Pro,Ny Huawei Band 4 Pro rem? Så er dette stedet for dig! Vi har det største udvalg i Danmark. Hurtig Levering.,,
huawei-band-6,Merge,Huawei Band 6,"Vil du gøre dit smartwatch mere personligt? Vi har et stort sortiment af alle slags Huawei Band 6 urremme, du finder remmene i massevis af farver og materialer. Så kan du finde netop den urrem, som du går og leder efter.",all conditions,Tag,Equals,Huawei Band 6,Huawei Band 6 Remme | Køb en Erstatningsrem til Huawei Band 6 Her,"Mangler du en ny Huawei Band 6 urrem? Her finder du et stort udvalg af alle slags remme. GRATIS fragt ved køb over 199,-",,Huawei Band 6 Series
huawei-band-6-pro,Merge,Huawei Band 6 Pro,Gør dit Huawei Band 6 Pro ur mere personlig med et ny rem. Vi har et stort udvalg af alle slags urremme med perfekt pasform.,all conditions,Tag,Equals,Huawei Band 6 Pro,Huawei Band 6 Pro Remme | Find en ny Urrem til Huawei Band 6 Pro Her,Stort udvalg af remme til Huawei Band 6 Pro. Danmarks Største udvalg af Smartwatch urremme. Vi sender inden kl. 15 i dag.,,Huawei Band 6 Series
huawei-band-6-series,Merge,Huawei Band 6 Series,Gør dit Huawei Band 6 Series ur mere personlig med et ny rem. Vi har et stort udvalg af alle slags urremme med perfekt pasform.,all conditions,Tag,Equals,Huawei Band 6 Series,Huawei Band 6 Series Urremme | Danmarks Største Udvalg af remme til Huawei Band 6 Series,"Kæmpe Udvalg af Huawei Band 6 Series Urremme. Køb for 199,- og vi betaler Fragten. Hurtigt Service. Danmarks Største Udvalg af Remme.",parent-collection,
huawei-band-7,Merge,Huawei Band 7,"Find en ny Huawei Band 7 rem i dag, eller få et ekstra, så du kan skifte imellem forskellige. En urrem kan give dit smartwatch et helt nyt look, og matche din egen personlige stil.",all conditions,Tag,Equals,Huawei Band 7,"Huawei Band 7 Urremme | Fri Levering over 199,-","Uremme der passer perfekt til Huawei Band 7. Vores lager er fyldt med flotte remme til ganske få kroner. Køber du for mere end 199kroner, betaler vi fragten.",,
huawei-children-s-watch-4x,Merge,Huawei Children's Watch 4X,Mangler du en ny Huawei Children's Watch 4X urrem? Så kan vi hjælpe dig. Vi har det største udvalg af urremme i Danmark.,all conditions,Tag,Equals,Huawei Children's Watch 4X,Huawei Children's Watch 4X Urremme | Lækre Urremme til Huawei Children's Watch 4X,"Uremme der passer perfekt til Huawei Children's Watch 4X. Vores lager er fyldt med flotte remme til ganske få kroner. Køber du for mere end 199kroner, betaler vi fragten.",,
huawei-honor-band-4,Merge,Huawei Honor Band 4,"Skal du bruge en ny Huawei Honor Band 4 urrem til enten træning eller hverdagen, så har vi heldigvis et hav af forskellige remme, som du kan vælge imellem.",all conditions,Tag,Equals,Huawei Honor Band 4,"Huawei Honor Band 4 Urremme | Urremme & Tilbehør - Fri Levering over 199,-","Uremme der passer perfekt til Huawei Honor Band 4. Vores lager er fyldt med flotte remme til ganske få kroner. Køber du for mere end 199kroner, betaler vi fragten.",,
huawei-kids-watch-3-pro,Merge,Huawei Kids Watch 3 Pro,"Vi har altid den urrem, som du mangler til Huawei Kids Watch 3 Pro. Bestiller du får mere end 199kr, så <b>betaler vi fragten</b>. Så fyld kurven op! Går du til kassen inden kl. 15, så sender vi din ordre afsted samme dag.",all conditions,Tag,Equals,Huawei Kids Watch 3 Pro,"Huawei Kids Watch 3 Pro Urremme | Gratis Levering over 199,-","Velkommen til et hav af Huawei Kids Watch 3 Pro Urremme. Bestil inden kl. 15 og vi sender samme dag. Fri Fragt ved køb over 199,-",,
huawei-talkband-b2-active,Merge,Huawei TalkBand B2 Active,"Enormt udvalg af urremme til Huawei TalkBand B2 Active . Vi har helt sikkert en rem, som du kan bruge.",all conditions,Tag,Equals,Huawei TalkBand B2 Active,"Huawei TalkBand B2 Active Remme | Gratis Fragt over 199,-",Lækre remme til Huawei TalkBand B2 Active. Kæmpe Udvalg. Hurtig Levering og FRI Fragt over 199kr.,,Huawei TalkBand Series
huawei-talkband-b3,Merge,Huawei TalkBand B3,"Stort udvalg af Huawei TalkBand B3 urremme. Hvis din stil er sporty eller klassisk, så kan du med garanti finde en urrem, der passer netop dig. Bestil inden. kl. 15 og vi sender hjem til dig i dag.",all conditions,Tag,Equals,Huawei TalkBand B3,Huawei TalkBand B3 Remme | Stort Sortiment af Urremme til Huawei TalkBand B3,"Velkommen til et hav af Huawei TalkBand B3 Urremme. Bestil inden kl. 15 og vi sender samme dag. Fri Fragt ved køb over 199,-",,Huawei TalkBand Series
huawei-talkband-b5,Merge,Huawei TalkBand B5,"Leder du efter en ny Huawei TalkBand B5 urrem? Så er du kommet til det rigtige sted! Vi har et hav af remme. Du finder <b>Danmarks største udvalg</b>, til at priser der er til at betale. Køb netop den rem, der passer perfekt ind til din livsstil. Husk at fylder du kurven for mere end 199KR, så betaler vi forsendelsen.",all conditions,Tag,Equals,Huawei TalkBand B5,"Huawei TalkBand B5 Remme | Fri Levering over 199,-","Velkommen til et hav af Huawei TalkBand B5 Urremme. Bestil inden kl. 15 og vi sender samme dag. Fri Fragt ved køb over 199,-",,Huawei TalkBand Series
