Handle,Command,Title,Body HTML,Must Match,Rule: Product Column,Rule: Relation,Rule: Condition,Metafield: title_tag [string],Metafield: description_tag [string],Template Suffix,Metafield: custom.belongs_to [single_line_text_field]
12mm,Merge,12mm,"Find en ny 12mm rem i dag, eller få et ekstra, så du kan skifte imellem forskellige. En urrem kan give dit smartwatch et helt nyt look, og matche din egen personlige stil.",all conditions,Tag,Equals,12mm,12mm Urremme | Køb ny Urrem til 12mm Her,"Alle slags 12mm Urremme. Danmarks Største Udvalg. Gratis Levering ved køb over 199,-",,Universal
14mm,Merge,14mm,"Her kan du finde en ny 14mm urrem. Du er heldigvis landet på danmarks største udvalg af smartwatch remme, så du kan helt sikkert finde noget du kan bruge.",all conditions,Tag,Equals,14mm,14mm Remme | Kæmpe Udvalg,"Uremme der passer perfekt til 14mm. Vores lager er fyldt med flotte remme til ganske få kroner. Køber du for mere end 199kroner, betaler vi fragten.",,Universal
16mm,Merge,16mm,"Leder du efter en ny 16mm urrem? Så er du kommet til det rigtige sted! Vi har et hav af remme. Du finder <b>Danmarks største udvalg</b>, til at priser der er til at betale. Køb netop den rem, der passer perfekt ind til din livsstil. Husk at fylder du kurven for mere end 199KR, så betaler vi forsendelsen.",all conditions,Tag,Equals,16mm,16mm Urremme | Mægtigt Sortiment af Remme til 16mm,"Alle slags 16mm Urremme. Danmarks Største Udvalg. Gratis Levering ved køb over 199,-",,Universal
17mm,Merge,17mm,Gør dit 17mm ur mere personlig med et ny rem. Vi har et stort udvalg af alle slags urremme med perfekt pasform.,all conditions,Tag,Equals,17mm,"17mm Urremme | Hurtig & Fri Fragt over 199,-","Mangler du en ny 17mm urrem? Her finder du et stort udvalg af alle slags remme. GRATIS fragt ved køb over 199,-",,Universal
18mm,Merge,18mm,Danmarks Bedste Udvalg af 18mm urremme. Den rem du leder efter finder du her på siden. Vi har i mange forskellige materialer og stilarter. Find den urrem du mangler i dag!,all conditions,Tag,Equals,18mm,18mm Urremme | Mægtigt Sortiment af Remme til 18mm,Ny 18mm rem? Så er dette stedet for dig! Vi har det største udvalg i Danmark. Hurtig Levering.,,Universal
19mm,Merge,19mm,"Skal du bruge en ny 19mm urrem til enten træning eller hverdagen, så har vi heldigvis et hav af forskellige remme, som du kan vælge imellem.",all conditions,Tag,Equals,19mm,19mm Remme | Bedste Sortiment af Remme til 19mm,Stort udvalg af remme til 19mm. Danmarks Største udvalg af Smartwatch urremme. Vi sender inden kl. 15 i dag.,,Universal
20mm,Merge,20mm,Mangler du en elegant eller behagelig 20mm urrem? Så er du heldig at du er landet hos os! Hos urrem.dk finder du Danmarks Største Udvalg af 20mm remme.,all conditions,Tag,Equals,20mm,20mm Remme | Køb en Erstatningsrem til 20mm Her,"Mangler du en ny 20mm urrem? Her finder du et stort udvalg af alle slags remme. GRATIS fragt ved køb over 199,-",,Universal
22mm,Merge,22mm,"Vi har altid den urrem, som du mangler til 22mm. Bestiller du får mere end 199kr, så <b>betaler vi fragten</b>. Så fyld kurven op! Går du til kassen inden kl. 15, så sender vi din ordre afsted samme dag.",all conditions,Tag,Equals,22mm,"22mm Remme | Hurtig & Fri Fragt over 199,-",Stort udvalg af remme til 22mm. Danmarks Største udvalg af Smartwatch urremme. Vi sender inden kl. 15 i dag.,,Universal
24mm,Merge,24mm,"Stort udvalg af 24mm urremme. Hvis din stil er sporty eller klassisk, så kan du med garanti finde en urrem, der passer netop dig. Bestil inden. kl. 15 og vi sender hjem til dig i dag.",all conditions,Tag,Equals,24mm,"24mm Urremme | Remme & Tilbehør - Fri Fragt over 199,-","Mangler du en ny 24mm urrem? Her finder du et stort udvalg af alle slags remme. GRATIS fragt ved køb over 199,-",,Universal
amazfit,Merge,Amazfit,"Find en ny Amazfit rem i dag, eller få et ekstra, så du kan skifte imellem forskellige. En urrem kan give dit smartwatch et helt nyt look, og matche din egen personlige stil.",all conditions,Tag,Equals,Amazfit,Amazfit Rem | Stort Udvalg,Ny Amazfit rem? Så er dette stedet for dig! Vi har det største udvalg i Danmark. Hurtig Levering.,,
amazfit-1,Merge,Amazfit 1,"Skal du bruge en ny Amazfit 1 urrem til enten træning eller hverdagen, så har vi heldigvis et hav af forskellige remme, som du kan vælge imellem.",all conditions,Tag,Equals,Amazfit 1,"Amazfit 1 Urremme | Urremme & Tilbehør - Fri Levering over 199,-","Kæmpe Udvalg af Amazfit 1 Urremme. Køb for 199,- og vi betaler Fragten. Hurtigt Service. Danmarks Største Udvalg af Remme.",,
amazfit-1s,Merge,Amazfit 1S,"Vil du gøre dit smartwatch mere personligt? Vi har et stort sortiment af alle slags Amazfit 1S urremme, du finder remmene i massevis af farver og materialer. Så kan du finde netop den urrem, som du går og leder efter.",all conditions,Tag,Equals,Amazfit 1S,Amazfit 1S Urremme | Stort Sortiment af Remme til Amazfit 1S,Lækre remme til Amazfit 1S. Kæmpe Udvalg. Hurtig Levering og FRI Fragt over 199kr.,,
amazfit-3,Merge,Amazfit 3,"Enormt udvalg af urremme til Amazfit 3 . Vi har helt sikkert en rem, som du kan bruge.",all conditions,Tag,Equals,Amazfit 3,Amazfit 3 Remme | Bedste Udvalg Remme til Amazfit 3,"Velkommen til et hav af Amazfit 3 Urremme. Bestil inden kl. 15 og vi sender samme dag. Fri Fragt ved køb over 199,-",,
amazfit-ares,Merge,Amazfit Ares,"Enormt udvalg af urremme til Amazfit Ares . Vi har helt sikkert en rem, som du kan bruge.",all conditions,Tag,Equals,Amazfit Ares,Amazfit Ares Remme | Køb ny rem til Amazfit Ares Her,Ny Amazfit Ares rem? Så er dette stedet for dig! Vi har det største udvalg i Danmark. Hurtig Levering.,,
amazfit-band-5,Merge,Amazfit Band 5,"Enormt udvalg af urremme til Amazfit Band 5 . Vi har helt sikkert en rem, som du kan bruge.",all conditions,Tag,Equals,Amazfit Band 5,"Amazfit Band 5 Remme | Remme & Tilbehør - Fri Fragt over 199,-","Mangler du en ny Amazfit Band 5 urrem? Her finder du et stort udvalg af alle slags remme. GRATIS fragt ved køb over 199,-",,
amazfit-bip,Merge,Amazfit Bip,"Vi har altid den urrem, som du mangler til Amazfit Bip. Bestiller du får mere end 199kr, så <b>betaler vi fragten</b>. Så fyld kurven op! Går du til kassen inden kl. 15, så sender vi din ordre afsted samme dag.",all conditions,Tag,Equals,Amazfit Bip,Amazfit Bip Remme | Stort Sortiment af Urremme til Amazfit Bip,"Alle slags Amazfit Bip Urremme. Danmarks Største Udvalg. Gratis Levering ved køb over 199,-",,Amazfit Bip Series
amazfit-bip-lite,Merge,Amazfit Bip Lite,"Har du brug for en Amazfit Bip Lite urrem, så er du landet på det helt rigtige sted. Vi har et kæmpe udvalg af remme i forskellige farver og materialer.",all conditions,Tag,Equals,Amazfit Bip Lite,Amazfit Bip Lite Remme | Kæmpestort Udvalg af Remme til Amazfit Bip Lite,"Kæmpe Udvalg af Amazfit Bip Lite Urremme. Køb for 199,- og vi betaler Fragten. Hurtigt Service. Danmarks Største Udvalg af Remme.",,Amazfit Bip Series
amazfit-bip-s,Merge,Amazfit Bip S,"Enormt udvalg af urremme til Amazfit Bip S . Vi har helt sikkert en rem, som du kan bruge.",all conditions,Tag,Equals,Amazfit Bip S,"Amazfit Bip S Remme | Giga Udvalg - Fri Fragt over 199,-","Kæmpe Udvalg af Amazfit Bip S Urremme. Køb for 199,- og vi betaler Fragten. Hurtigt Service. Danmarks Største Udvalg af Remme.",,Amazfit Bip Series
amazfit-bip-series,Merge,Amazfit Bip Series,"Her kan du finde en ny Amazfit Bip Series urrem. Du er heldigvis landet på danmarks største udvalg af smartwatch remme, så du kan helt sikkert finde noget du kan bruge.",all conditions,Tag,Equals,Amazfit Bip Series,"Amazfit Bip Series Urremme | Giga Udvalg - Fri Fragt over 199,-","Kæmpe Udvalg af Amazfit Bip Series Urremme. Køb for 199,- og vi betaler Fragten. Hurtigt Service. Danmarks Største Udvalg af Remme.",parent-collection,Amazfit
amazfit-bip-u,Merge,Amazfit Bip U,"Find en ny Amazfit Bip U rem i dag, eller få et ekstra, så du kan skifte imellem forskellige. En urrem kan give dit smartwatch et helt nyt look, og matche din egen personlige stil.",all conditions,Tag,Equals,Amazfit Bip U,"Amazfit Bip U Urremme | Gratis Fragt over 199,-",Stort udvalg af remme til Amazfit Bip U. Danmarks Største udvalg af Smartwatch urremme. Vi sender inden kl. 15 i dag.,,Amazfit Bip Series
amazfit-cor,Merge,Amazfit Cor,"Her har du hele vores udvalg af remme til Amazfit Cor. Med en ny urrem kan du gøre dit smartwatch mere personlig. De er nemme at udskifte, så du kan også fylde skuffen med forskellige urremme og udskifte dem efter behov. Køber du får mere end 199,- så leverer vi kvit og frit.",all conditions,Tag,Equals,Amazfit Cor,"Amazfit Cor Urremme | Bedste Udvalg - Fri Fragt over 199,-","Kæmpe Udvalg af Amazfit Cor Urremme. Køb for 199,- og vi betaler Fragten. Hurtigt Service. Danmarks Største Udvalg af Remme.",,
amazfit-gtr-2,Merge,Amazfit GTR 2,"Her har du hele vores udvalg af remme til Amazfit GTR 2. Med en ny urrem kan du gøre dit smartwatch mere personlig. De er nemme at udskifte, så du kan også fylde skuffen med forskellige urremme og udskifte dem efter behov. Køber du får mere end 199,- så leverer vi kvit og frit.",all conditions,Tag,Equals,Amazfit GTR 2,"Amazfit GTR 2 Remme | Giga Udvalg - Fri Fragt over 199,-",Ny Amazfit GTR 2 rem? Så er dette stedet for dig! Vi har det største udvalg i Danmark. Hurtig Levering.,,Amazfit GTR Series
amazfit-gtr-2e,Merge,Amazfit GTR 2e,"Her har du hele vores udvalg af remme til Amazfit GTR 2e. Med en ny urrem kan du gøre dit smartwatch mere personlig. De er nemme at udskifte, så du kan også fylde skuffen med forskellige urremme og udskifte dem efter behov. Køber du får mere end 199,- så leverer vi kvit og frit.",all conditions,Tag,Equals,Amazfit GTR 2e,Amazfit GTR 2e Urremme | Find en ny Urrem til Amazfit GTR 2e Her,Ny Amazfit GTR 2e rem? Så er dette stedet for dig! Vi har det største udvalg i Danmark. Hurtig Levering.,,Amazfit GTR Series
amazfit-gtr-3,Merge,Amazfit GTR 3,"Stort udvalg af Amazfit GTR 3 urremme. Hvis din stil er sporty eller klassisk, så kan du med garanti finde en urrem, der passer netop dig. Bestil inden. kl. 15 og vi sender hjem til dig i dag.",all conditions,Tag,Equals,Amazfit GTR 3,"Amazfit GTR 3 Urremme | Stort Vareudvalg - Fri Fragt over 199,-",Ny Amazfit GTR 3 rem? Så er dette stedet for dig! Vi har det største udvalg i Danmark. Hurtig Levering.,,Amazfit GTR Series
amazfit-gtr-3-pro,Merge,Amazfit GTR 3 Pro,"Stort udvalg af Amazfit GTR 3 Pro urremme. Hvis din stil er sporty eller klassisk, så kan du med garanti finde en urrem, der passer netop dig. Bestil inden. kl. 15 og vi sender hjem til dig i dag.",all conditions,Tag,Equals,Amazfit GTR 3 Pro,"Amazfit GTR 3 Pro Urremme | Stort Vareudvalg - Fri Fragt over 199,-","Kæmpe Udvalg af Amazfit GTR 3 Pro Urremme. Køb for 199,- og vi betaler Fragten. Hurtigt Service. Danmarks Største Udvalg af Remme.",,Amazfit GTR Series
amazfit-gtr-42mm,Merge,Amazfit GTR 42mm,"Her har du hele vores udvalg af remme til Amazfit GTR 42mm. Med en ny urrem kan du gøre dit smartwatch mere personlig. De er nemme at udskifte, så du kan også fylde skuffen med forskellige urremme og udskifte dem efter behov. Køber du får mere end 199,- så leverer vi kvit og frit.",all conditions,Tag,Equals,Amazfit GTR 42mm,"Amazfit GTR 42mm Remme | Fri Fragt over 199,-","Alle slags Amazfit GTR 42mm Urremme. Danmarks Største Udvalg. Gratis Levering ved køb over 199,-",,Amazfit GTR Series
amazfit-gtr-47mm,Merge,Amazfit GTR 47mm,"Stort udvalg af Amazfit GTR 47mm urremme. Hvis din stil er sporty eller klassisk, så kan du med garanti finde en urrem, der passer netop dig. Bestil inden. kl. 15 og vi sender hjem til dig i dag.",all conditions,Tag,Equals,Amazfit GTR 47mm,Amazfit GTR 47mm Remme | Mægtigt Sortiment af Urremme til Amazfit GTR 47mm,Er det på tide at udskifte din Amazfit GTR 47mm rem? Her kan du købe en nye til få penge. Vi sender inden kl. 15,,Amazfit GTR Series
amazfit-gtr-series,Merge,Amazfit GTR Series,"Vi har altid den urrem, som du mangler til Amazfit GTR Series. Bestiller du får mere end 199kr, så <b>betaler vi fragten</b>. Så fyld kurven op! Går du til kassen inden kl. 15, så sender vi din ordre afsted samme dag.",all conditions,Tag,Equals,Amazfit GTR Series,Amazfit GTR Series Urremme | Mægtigt Sortiment,"Kæmpe Udvalg af Amazfit GTR Series Urremme. Køb for 199,- og vi betaler Fragten. Hurtigt Service. Danmarks Største Udvalg af Remme.",parent-collection,Amazfit
amazfit-gts,Merge,Amazfit GTS,"Vi har altid den urrem, som du mangler til Amazfit GTS. Bestiller du får mere end 199kr, så <b>betaler vi fragten</b>. Så fyld kurven op! Går du til kassen inden kl. 15, så sender vi din ordre afsted samme dag.",all conditions,Tag,Equals,Amazfit GTS,Amazfit GTS Urremme | Find en ny rem til Amazfit GTS Her,Stort Sortiment af Amazfit GTS Urremme. Hurtig Levering. Bedste udvalg og høj service. Find din nye rem i dag.,,Amazfit GTS Series
amazfit-gts-2,Merge,Amazfit GTS 2,"Har du brug for en Amazfit GTS 2 urrem, så er du landet på det helt rigtige sted. Vi har et kæmpe udvalg af remme i forskellige farver og materialer.",all conditions,Tag,Equals,Amazfit GTS 2,Amazfit GTS 2 Remme | Største Udvalg i Danmark,"Uremme til Amazfit GTS 2 hos Danmarks Største Udvalg. Bestil inden. Kl 15 og vi sender i Dag. Køb for mere end 199,- og du får Gratis Fragt.",,Amazfit GTS Series
amazfit-gts-2-mini,Merge,Amazfit GTS 2 Mini,"Har du brug for en Amazfit GTS 2 Mini urrem, så er du landet på det helt rigtige sted. Vi har et kæmpe udvalg af remme i forskellige farver og materialer.",all conditions,Tag,Equals,Amazfit GTS 2 Mini,Amazfit GTS 2 Mini Urremme | Gigantisk Udvalg,"Alle slags Amazfit GTS 2 Mini Urremme. Danmarks Største Udvalg. Gratis Levering ved køb over 199,-",,Amazfit GTS Series
amazfit-gts-2e,Merge,Amazfit GTS 2e,"De bedste urremme til Amazfit GTS 2e. Mangler du en ny rem til løbeturen eller når du skal til møde? Vi tilbyder alle slags remme, der passer til dig og dit smartwatch. <b>Gratis Fragt</b> ved køb for mere end 199kr.",all conditions,Tag,Equals,Amazfit GTS 2e,Amazfit GTS 2e Remme | Køb en Erstatningsrem til Amazfit GTS 2e Her,Stort udvalg af remme til Amazfit GTS 2e. Danmarks Største udvalg af Smartwatch urremme. Vi sender inden kl. 15 i dag.,,Amazfit GTS Series
amazfit-gts-3,Merge,Amazfit GTS 3,"Skal du bruge en ny Amazfit GTS 3 urrem til enten træning eller hverdagen, så har vi heldigvis et hav af forskellige remme, som du kan vælge imellem.",all conditions,Tag,Equals,Amazfit GTS 3,Amazfit GTS 3 Remme | Find en ny Urrem til Amazfit GTS 3 Her,"Alle slags Amazfit GTS 3 Urremme. Danmarks Største Udvalg. Gratis Levering ved køb over 199,-",,Amazfit GTS Series
amazfit-gts-series,Merge,Amazfit GTS Series,Mangler du en ny Amazfit GTS Series urrem? Så kan vi hjælpe dig. Vi har det største udvalg af urremme i Danmark.,all conditions,Tag,Equals,Amazfit GTS Series,"Amazfit GTS Series Urremme | Hurtig & Gratis Fragt over 199,-","Alle slags Amazfit GTS Series Urremme. Danmarks Største Udvalg. Gratis Levering ved køb over 199,-",parent-collection,Amazfit
amazfit-neo,Merge,Amazfit Neo,"Vi har altid den urrem, som du mangler til Amazfit Neo. Bestiller du får mere end 199kr, så <b>betaler vi fragten</b>. Så fyld kurven op! Går du til kassen inden kl. 15, så sender vi din ordre afsted samme dag.",all conditions,Tag,Equals,Amazfit Neo,Amazfit Neo Remme | Mægtigt Sortiment af Urremme til Amazfit Neo,Stort Sortiment af Amazfit Neo Urremme. Hurtig Levering. Bedste udvalg og høj service. Find din nye rem i dag.,,
amazfit-pace,Merge,Amazfit Pace,"Leder du efter en ny Amazfit Pace urrem? Så er du kommet til det rigtige sted! Vi har et hav af remme. Du finder <b>Danmarks største udvalg</b>, til at priser der er til at betale. Køb netop den rem, der passer perfekt ind til din livsstil. Husk at fylder du kurven for mere end 199KR, så betaler vi forsendelsen.",all conditions,Tag,Equals,Amazfit Pace,Amazfit Pace Urremme | Stort Sortiment af Urremme til Amazfit Pace,"Kæmpe Udvalg af Amazfit Pace Urremme. Køb for 199,- og vi betaler Fragten. Hurtigt Service. Danmarks Største Udvalg af Remme.",,
amazfit-pop,Merge,Amazfit Pop,Mangler du en elegant eller behagelig Amazfit Pop urrem? Så er du heldig at du er landet hos os! Hos urrem.dk finder du Danmarks Største Udvalg af Amazfit Pop remme.,all conditions,Tag,Equals,Amazfit Pop,"Amazfit Pop Urremme | Hurtig & Fri Fragt over 199,-","Mangler du en ny Amazfit Pop urrem? Her finder du et stort udvalg af alle slags remme. GRATIS fragt ved køb over 199,-",,
amazfit-pop-pro,Merge,Amazfit Pop Pro,"Enormt udvalg af urremme til Amazfit Pop Pro . Vi har helt sikkert en rem, som du kan bruge.",all conditions,Tag,Equals,Amazfit Pop Pro,Amazfit Pop Pro Remme | Stort Sortiment af Urremme til Amazfit Pop Pro,"Uremme der passer perfekt til Amazfit Pop Pro. Vores lager er fyldt med flotte remme til ganske få kroner. Køber du for mere end 199kroner, betaler vi fragten.",,
amazfit-smartwatch-2,Merge,Amazfit Smartwatch 2,"Velkommen til et godt udvalg af Amazfit Smartwatch 2 urremme. Fylder du kurven for mere end 199kroner, så får du <b>gratis levering.</b>.",all conditions,Tag,Equals,Amazfit Smartwatch 2,"Amazfit Smartwatch 2 Remme | Hurtig & Fri Levering over 199,-",Lækre remme til Amazfit Smartwatch 2. Kæmpe Udvalg. Hurtig Levering og FRI Fragt over 199kr.,,
amazfit-stratos,Merge,Amazfit Stratos,"Vi har altid den urrem, som du mangler til Amazfit Stratos. Bestiller du får mere end 199kr, så <b>betaler vi fragten</b>. Så fyld kurven op! Går du til kassen inden kl. 15, så sender vi din ordre afsted samme dag.",all conditions,Tag,Equals,Amazfit Stratos,Amazfit Stratos Urremme | Stort Sortiment af Urremme til Amazfit Stratos,Er det på tide at udskifte din Amazfit Stratos rem? Her kan du købe en nye til få penge. Vi sender inden kl. 15,,Amazfit Stratos Series
amazfit-stratos-2-2s,Merge,Amazfit Stratos 2 \ 2s,Gør dit Amazfit Stratos 2 \ 2s ur mere personlig med et ny rem. Vi har et stort udvalg af alle slags urremme med perfekt pasform.,all conditions,Tag,Equals,Amazfit Stratos 2 \ 2s,Amazfit Stratos 2 \ 2s Urremme | Gigantisk Udvalg,Ny Amazfit Stratos 2 \ 2s rem? Så er dette stedet for dig! Vi har det største udvalg i Danmark. Hurtig Levering.,,Amazfit Stratos Series
amazfit-stratos-3,Merge,Amazfit Stratos 3,"Find en ny Amazfit Stratos 3 rem i dag, eller få et ekstra, så du kan skifte imellem forskellige. En urrem kan give dit smartwatch et helt nyt look, og matche din egen personlige stil.",all conditions,Tag,Equals,Amazfit Stratos 3,Amazfit Stratos 3 Remme | Mægtigt Sortiment af Urremme til Amazfit Stratos 3,"Alle slags Amazfit Stratos 3 Urremme. Danmarks Største Udvalg. Gratis Levering ved køb over 199,-",,Amazfit Stratos Series
amazfit-stratos-series,Merge,Amazfit Stratos Series,"Enormt udvalg af urremme til Amazfit Stratos Series . Vi har helt sikkert en rem, som du kan bruge.",all conditions,Tag,Equals,Amazfit Stratos Series,Amazfit Stratos Series Urremme | Køb en Erstatningsrem til Amazfit Stratos Series Her,"Mangler du en ny Amazfit Stratos Series urrem? Her finder du et stort udvalg af alle slags remme. GRATIS fragt ved køb over 199,-",parent-collection,Amazfit
amazfit-t-rex,Merge,Amazfit T-Rex,"Skal du bruge en ny Amazfit T-Rex urrem til enten træning eller hverdagen, så har vi heldigvis et hav af forskellige remme, som du kan vælge imellem.",all conditions,Tag,Equals,Amazfit T-Rex,"Amazfit T-Rex Remme | Bedste Udvalg - Fri Fragt over 199,-",Er det på tide at udskifte din Amazfit T-Rex rem? Her kan du købe en nye til få penge. Vi sender inden kl. 15,,Amazfit T-Rex Series
amazfit-t-rex-pro,Merge,Amazfit T-Rex Pro,Mangler du en elegant eller behagelig Amazfit T-Rex Pro urrem? Så er du heldig at du er landet hos os! Hos urrem.dk finder du Danmarks Største Udvalg af Amazfit T-Rex Pro remme.,all conditions,Tag,Equals,Amazfit T-Rex Pro,Amazfit T-Rex Pro Urremme | Køb ny rem til Amazfit T-Rex Pro Her,"Alle slags Amazfit T-Rex Pro Urremme. Danmarks Største Udvalg. Gratis Levering ved køb over 199,-",,Amazfit T-Rex Series
amazfit-t-rex-series,Merge,Amazfit T-Rex Series,"Vil du gøre dit smartwatch mere personligt? Vi har et stort sortiment af alle slags Amazfit T-Rex Series urremme, du finder remmene i massevis af farver og materialer. Så kan du finde netop den urrem, som du går og leder efter.",all conditions,Tag,Equals,Amazfit T-Rex Series,"Amazfit T-Rex Series Remme | Kæmpe Udvalg - Fri Fragt over 199,-","Velkommen til et hav af Amazfit T-Rex Series Urremme. Bestil inden kl. 15 og vi sender samme dag. Fri Fragt ved køb over 199,-",parent-collection,
amazfit-verge-3,Merge,Amazfit Verge 3,"Her har du hele vores udvalg af remme til Amazfit Verge 3. Med en ny urrem kan du gøre dit smartwatch mere personlig. De er nemme at udskifte, så du kan også fylde skuffen med forskellige urremme og udskifte dem efter behov. Køber du får mere end 199,- så leverer vi kvit og frit.",all conditions,Tag,Equals,Amazfit Verge 3,Amazfit Verge 3 Urremme | Stort Sortiment af Urremme til Amazfit Verge 3,"Uremme der passer perfekt til Amazfit Verge 3. Vores lager er fyldt med flotte remme til ganske få kroner. Køber du for mere end 199kroner, betaler vi fragten.",,
amazfit-x,Merge,Amazfit X,Mangler du en ny Amazfit X urrem? Så kan vi hjælpe dig. Vi har det største udvalg af urremme i Danmark.,all conditions,Tag,Equals,Amazfit X,"Amazfit X Urremme | Hurtig & Fri Levering over 199,-",Stort Sortiment af Amazfit X Urremme. Hurtig Levering. Bedste udvalg og høj service. Find din nye rem i dag.,,
amazfit-youth,Merge,Amazfit Youth,"Her har du hele vores udvalg af remme til Amazfit Youth. Med en ny urrem kan du gøre dit smartwatch mere personlig. De er nemme at udskifte, så du kan også fylde skuffen med forskellige urremme og udskifte dem efter behov. Køber du får mere end 199,- så leverer vi kvit og frit.",all conditions,Tag,Equals,Amazfit Youth,"Amazfit Youth Remme | Kæmpe Udvalg - Fri Fragt over 199,-",Lækre remme til Amazfit Youth. Kæmpe Udvalg. Hurtig Levering og FRI Fragt over 199kr.,,Amazfit Youth Series
amazfit-youth-edition-1s,Merge,Amazfit Youth Edition 1S,Mangler du en ny Amazfit Youth Edition 1S urrem? Så kan vi hjælpe dig. Vi har det største udvalg af urremme i Danmark.,all conditions,Tag,Equals,Amazfit Youth Edition 1S,Amazfit Youth Edition 1S Remme | Mægtigt Sortiment af Urremme til Amazfit Youth Edition 1S,Ny Amazfit Youth Edition 1S rem? Så er dette stedet for dig! Vi har det største udvalg i Danmark. Hurtig Levering.,,Amazfit Youth Series
amazfit-youth-series,Merge,Amazfit Youth Series,Gør dit Amazfit Youth Series ur mere personlig med et ny rem. Vi har et stort udvalg af alle slags urremme med perfekt pasform.,all conditions,Tag,Equals,Amazfit Youth Series,Amazfit Youth Series Urremme | Køb ny rem til Amazfit Youth Series Her,"Mangler du en ny Amazfit Youth Series urrem? Her finder du et stort udvalg af alle slags remme. GRATIS fragt ved køb over 199,-",parent-collection,Amazfit
amazon,Merge,Amazon,"Vil du gøre dit smartwatch mere personligt? Vi har et stort sortiment af alle slags Amazon urremme, du finder remmene i massevis af farver og materialer. Så kan du finde netop den urrem, som du går og leder efter.",all conditions,Tag,Equals,Amazon,Amazon Remme | Stort Sortiment af Remme til Amazon,Stort Sortiment af Amazon Urremme. Hurtig Levering. Bedste udvalg og høj service. Find din nye rem i dag.,,
amazon-halo-band,Merge,Amazon Halo Band,Gør dit Amazon Halo Band ur mere personlig med et ny rem. Vi har et stort udvalg af alle slags urremme med perfekt pasform.,all conditions,Tag,Equals,Amazon Halo Band,"Amazon Halo Band Remme | Gratis Levering over 199,-","Kæmpe Udvalg af Amazon Halo Band Urremme. Køb for 199,- og vi betaler Fragten. Hurtigt Service. Danmarks Største Udvalg af Remme.",,
amazon-halo-view,Merge,Amazon Halo View,"De bedste urremme til Amazon Halo View. Mangler du en ny rem til løbeturen eller når du skal til møde? Vi tilbyder alle slags remme, der passer til dig og dit smartwatch. <b>Gratis Fragt</b> ved køb for mere end 199kr.",all conditions,Tag,Equals,Amazon Halo View,Amazon Halo View Urremme | Gigantisk Udvalg af Remme til Amazon Halo View,Ny Amazon Halo View rem? Så er dette stedet for dig! Vi har det største udvalg i Danmark. Hurtig Levering.,,
apple-watch,Merge,Apple Watch,"Velkommen til et godt udvalg af Apple Watch urremme. Fylder du kurven for mere end 199kroner, så får du <b>gratis levering.</b>.",all conditions,Tag,Equals,Apple Watch,"Apple Watch Rem | Giga Udvalg - Fri Fragt over 199,-","Alle slags Apple Watch Urremme. Danmarks Største Udvalg. Gratis Levering ved køb over 199,-",,
apple-watch-40mm,Merge,Apple Watch 40mm,"Find en ny Apple Watch 40mm rem i dag, eller få et ekstra, så du kan skifte imellem forskellige. En urrem kan give dit smartwatch et helt nyt look, og matche din egen personlige stil.",all conditions,Tag,Equals,Apple Watch 40mm,"Urrem Til Apple Watch 40mm | Gratis Levering over 199,-","Alle slags Apple Watch 40mm Urremme. Danmarks Største Udvalg. Gratis Levering ved køb over 199,-",,Apple Watch Series
apple-watch-41mm,Merge,Apple Watch 41mm,"Her har du hele vores udvalg af remme til Apple Watch 41mm. Med en ny urrem kan du gøre dit smartwatch mere personlig. De er nemme at udskifte, så du kan også fylde skuffen med forskellige urremme og udskifte dem efter behov. Køber du får mere end 199,- så leverer vi kvit og frit.",all conditions,Tag,Equals,Apple Watch 41mm,Rem Til Apple Watch 41mm | Bedste Sortiment af Remme til Apple Watch 41mm,Er det på tide at udskifte din Apple Watch 41mm rem? Her kan du købe en nye til få penge. Vi sender inden kl. 15,,Apple Watch Series
