Handle,Command,Title,Body HTML,Must Match,Rule: Product Column,Rule: Relation,Rule: Condition,Metafield: title_tag [string],Metafield: description_tag [string],Template Suffix,Metafield: custom.belongs_to [single_line_text_field]
motorola-moto-360-42mm,Merge,Motorola Moto 360 - 42mm,Mangler du en ny Motorola Moto 360 - 42mm urrem? Så kan vi hjælpe dig. Vi har det største udvalg af urremme i Danmark.,all conditions,Tag,Equals,Motorola Moto 360 - 42mm,"Motorola Moto 360 - 42mm Urremme | Gratis Levering over 199,-",Lækre remme til Motorola Moto 360 - 42mm. Kæmpe Udvalg. Hurtig Levering og FRI Fragt over 199kr.,,
motorola-moto-360-46mm,Merge,Motorola Moto 360 - 46mm,"Leder du efter en ny Motorola Moto 360 - 46mm urrem? Så er du kommet til det rigtige sted! Vi har et hav af remme. Du finder <b>Danmarks største udvalg</b>, til at priser der er til at betale. Køb netop den rem, der passer perfekt ind til din livsstil. Husk at fylder du kurven for mere end 199KR, så betaler vi forsendelsen.",all conditions,Tag,Equals,Motorola Moto 360 - 46mm,Motorola Moto 360 - 46mm Remme | Bedste Udvalg Remme til Motorola Moto 360 - 46mm,Stort udvalg af remme til Motorola Moto 360 - 46mm. Danmarks Største udvalg af Smartwatch urremme. Vi sender inden kl. 15 i dag.,,
noise,Merge,Noise,Mangler du en ny Noise urrem? Så kan vi hjælpe dig. Vi har det største udvalg af urremme i Danmark.,all conditions,Tag,Equals,Noise,Noise Urremme | Mægtigt Sortiment,Ny Noise rem? Så er dette stedet for dig! Vi har det største udvalg i Danmark. Hurtig Levering.,,
noise-colorfit-pro-2,Merge,Noise ColorFit Pro 2,"Velkommen til et godt udvalg af Noise ColorFit Pro 2 urremme. Fylder du kurven for mere end 199kroner, så får du <b>gratis levering.</b>.",all conditions,Tag,Equals,Noise ColorFit Pro 2,Noise ColorFit Pro 2 Remme | Kæmpestort Udvalg,"Alle slags Noise ColorFit Pro 2 Urremme. Danmarks Største Udvalg. Gratis Levering ved køb over 199,-",,
noise-colorfit-pulse,Merge,Noise ColorFit Pulse,"Enormt udvalg af urremme til Noise ColorFit Pulse . Vi har helt sikkert en rem, som du kan bruge.",all conditions,Tag,Equals,Noise ColorFit Pulse,"Noise ColorFit Pulse Urremme | Hurtig & Fri Fragt over 199,-","Velkommen til et hav af Noise ColorFit Pulse Urremme. Bestil inden kl. 15 og vi sender samme dag. Fri Fragt ved køb over 199,-",,
nokia-smartwatch,Merge,Nokia Smartwatch,"Enormt udvalg af urremme til Nokia Smartwatch . Vi har helt sikkert en rem, som du kan bruge.",all conditions,Tag,Equals,Nokia Smartwatch,"Nokia Smartwatch Urremme | Giga Udvalg - Fri Fragt over 199,-","Uremme der passer perfekt til Nokia Smartwatch. Vores lager er fyldt med flotte remme til ganske få kroner. Køber du for mere end 199kroner, betaler vi fragten.",,
nokia-steel-hr,Merge,Nokia Steel HR,Mangler du en elegant eller behagelig Nokia Steel HR urrem? Så er du heldig at du er landet hos os! Hos urrem.dk finder du Danmarks Største Udvalg af Nokia Steel HR remme.,all conditions,Tag,Equals,Nokia Steel HR,Nokia Steel HR Urremme | Kæmpe Udvalg,Lækre remme til Nokia Steel HR. Kæmpe Udvalg. Hurtig Levering og FRI Fragt over 199kr.,,
oneplus,Merge,OnePlus,"Vil du gøre dit smartwatch mere personligt? Vi har et stort sortiment af alle slags OnePlus urremme, du finder remmene i massevis af farver og materialer. Så kan du finde netop den urrem, som du går og leder efter.",all conditions,Tag,Equals,OnePlus,Oneplus Tilbehør | Giga Udvalg,"Uremme der passer perfekt til OnePlus. Vores lager er fyldt med flotte remme til ganske få kroner. Køber du for mere end 199kroner, betaler vi fragten.",,
oneplus-watch,Merge,OnePlus Watch,"Vi har altid den urrem, som du mangler til OnePlus Watch. Bestiller du får mere end 199kr, så <b>betaler vi fragten</b>. Så fyld kurven op! Går du til kassen inden kl. 15, så sender vi din ordre afsted samme dag.",all conditions,Tag,Equals,OnePlus Watch,OnePlus Watch Urremme | Kæmpestort Udvalg af Remme til OnePlus Watch,Stort udvalg af remme til OnePlus Watch. Danmarks Største udvalg af Smartwatch urremme. Vi sender inden kl. 15 i dag.,,
oppo,Merge,Oppo,Mangler du en elegant eller behagelig Oppo urrem? Så er du heldig at du er landet hos os! Hos urrem.dk finder du Danmarks Største Udvalg af Oppo remme.,all conditions,Tag,Equals,Oppo,Oppo Urremme | Danmarks Største Udvalg af remme til Oppo,"Mangler du en ny Oppo urrem? Her finder du et stort udvalg af alle slags remme. GRATIS fragt ved køb over 199,-",,
oppo-band,Merge,Oppo Band,"Stort udvalg af Oppo Band urremme. Hvis din stil er sporty eller klassisk, så kan du med garanti finde en urrem, der passer netop dig. Bestil inden. kl. 15 og vi sender hjem til dig i dag.",all conditions,Tag,Equals,Oppo Band,Oppo Band Remme | Køb ny Urrem til Oppo Band Her,"Kæmpe Udvalg af Oppo Band Urremme. Køb for 199,- og vi betaler Fragten. Hurtigt Service. Danmarks Største Udvalg af Remme.",,
oppo-band-style,Merge,Oppo Band Style,"Leder du efter en ny Oppo Band Style urrem? Så er du kommet til det rigtige sted! Vi har et hav af remme. Du finder <b>Danmarks største udvalg</b>, til at priser der er til at betale. Køb netop den rem, der passer perfekt ind til din livsstil. Husk at fylder du kurven for mere end 199KR, så betaler vi forsendelsen.",all conditions,Tag,Equals,Oppo Band Style,"Oppo Band Style Remme | Bedste Udvalg - Fri Fragt over 199,-",Stort Sortiment af Oppo Band Style Urremme. Hurtig Levering. Bedste udvalg og høj service. Find din nye rem i dag.,,
oppo-watch-41mm,Merge,Oppo Watch (41mm),"Enormt udvalg af urremme til Oppo Watch (41mm) . Vi har helt sikkert en rem, som du kan bruge.",all conditions,Tag,Equals,Oppo Watch (41mm),Oppo Watch (41mm) Urremme | Mægtigt Sortiment af Remme til Oppo Watch (41mm),"Alle slags Oppo Watch (41mm) Urremme. Danmarks Største Udvalg. Gratis Levering ved køb over 199,-",,
oppo-watch-46mm,Merge,Oppo Watch (46mm),"Har du brug for en Oppo Watch (46mm) urrem, så er du landet på det helt rigtige sted. Vi har et kæmpe udvalg af remme i forskellige farver og materialer.",all conditions,Tag,Equals,Oppo Watch (46mm),Oppo Watch (46mm) Urremme | Mægtigt Sortiment af Remme til Oppo Watch (46mm),Lækre remme til Oppo Watch (46mm). Kæmpe Udvalg. Hurtig Levering og FRI Fragt over 199kr.,,
oppo-watch-2-42mm,Merge,Oppo Watch 2 (42mm),Er det på tide at udskifte remmen? Du finder et vælg af <b>Oppo Watch 2 (42mm) urremme</b> her hos Danmarks største udvalg.,all conditions,Tag,Equals,Oppo Watch 2 (42mm),"Oppo Watch 2 (42mm) Remme | Gratis Fragt over 199,-","Velkommen til et hav af Oppo Watch 2 (42mm) Urremme. Bestil inden kl. 15 og vi sender samme dag. Fri Fragt ved køb over 199,-",,
oppo-watch-2-46mm,Merge,Oppo Watch 2 (46mm),"Find en ny Oppo Watch 2 (46mm) rem i dag, eller få et ekstra, så du kan skifte imellem forskellige. En urrem kan give dit smartwatch et helt nyt look, og matche din egen personlige stil.",all conditions,Tag,Equals,Oppo Watch 2 (46mm),Oppo Watch 2 (46mm) Urremme | Mægtigt Udvalg af Urremme til Oppo Watch 2 (46mm),"Mangler du en ny Oppo Watch 2 (46mm) urrem? Her finder du et stort udvalg af alle slags remme. GRATIS fragt ved køb over 199,-",,
oppo-watch-free,Merge,Oppo Watch Free,"Stort udvalg af Oppo Watch Free urremme. Hvis din stil er sporty eller klassisk, så kan du med garanti finde en urrem, der passer netop dig. Bestil inden. kl. 15 og vi sender hjem til dig i dag.",all conditions,Tag,Equals,Oppo Watch Free,Oppo Watch Free Remme | Mægtigt Sortiment,Lækre remme til Oppo Watch Free. Kæmpe Udvalg. Hurtig Levering og FRI Fragt over 199kr.,,
pebble,Merge,Pebble,"Velkommen til et godt udvalg af Pebble urremme. Fylder du kurven for mere end 199kroner, så får du <b>gratis levering.</b>.",all conditions,Tag,Equals,Pebble,Pebble Urremme | Bedste Udvalg i Danmark,Er det på tide at udskifte din Pebble rem? Her kan du købe en nye til få penge. Vi sender inden kl. 15,,
pebble-2-2-se,Merge,Pebble 2 \ 2 SE,"Enormt udvalg af urremme til Pebble 2 \ 2 SE . Vi har helt sikkert en rem, som du kan bruge.",all conditions,Tag,Equals,Pebble 2 \ 2 SE,"Pebble 2 \ 2 SE Remme | Hurtig & Fri Fragt over 199,-","Alle slags Pebble 2 \ 2 SE Urremme. Danmarks Største Udvalg. Gratis Levering ved køb over 199,-",,
pebble-classic,Merge,Pebble Classic,"Vi har altid den urrem, som du mangler til Pebble Classic. Bestiller du får mere end 199kr, så <b>betaler vi fragten</b>. Så fyld kurven op! Går du til kassen inden kl. 15, så sender vi din ordre afsted samme dag.",all conditions,Tag,Equals,Pebble Classic,Pebble Classic Remme | Enormt Udvalg,Stort udvalg af remme til Pebble Classic. Danmarks Største udvalg af Smartwatch urremme. Vi sender inden kl. 15 i dag.,,
pebble-time,Merge,Pebble Time,"Find en ny Pebble Time rem i dag, eller få et ekstra, så du kan skifte imellem forskellige. En urrem kan give dit smartwatch et helt nyt look, og matche din egen personlige stil.",all conditions,Tag,Equals,Pebble Time,Pebble Time Urremme | Find en ny Urrem til Pebble Time Her,Lækre remme til Pebble Time. Kæmpe Udvalg. Hurtig Levering og FRI Fragt over 199kr.,,
pebble-time-round-large,Merge,Pebble Time Round Large,"Stort udvalg af Pebble Time Round Large urremme. Hvis din stil er sporty eller klassisk, så kan du med garanti finde en urrem, der passer netop dig. Bestil inden. kl. 15 og vi sender hjem til dig i dag.",all conditions,Tag,Equals,Pebble Time Round Large,Pebble Time Round Large Urremme | Bedste Sortiment af Remme til Pebble Time Round Large,Er det på tide at udskifte din Pebble Time Round Large rem? Her kan du købe en nye til få penge. Vi sender inden kl. 15,,
pebble-time-steel,Merge,Pebble Time Steel,"Stort udvalg af Pebble Time Steel urremme. Hvis din stil er sporty eller klassisk, så kan du med garanti finde en urrem, der passer netop dig. Bestil inden. kl. 15 og vi sender hjem til dig i dag.",all conditions,Tag,Equals,Pebble Time Steel,Pebble Time Steel Urremme | Enormt Udvalg af Urremme til Pebble Time Steel,"Uremme der passer perfekt til Pebble Time Steel. Vores lager er fyldt med flotte remme til ganske få kroner. Køber du for mere end 199kroner, betaler vi fragten.",,
polar,Merge,Polar,Gør dit Polar ur mere personlig med et ny rem. Vi har et stort udvalg af alle slags urremme med perfekt pasform.,all conditions,Tag,Equals,Polar,Polar Urrem | Lækre Urremme til Polar,"Kæmpe Udvalg af Polar Urremme. Køb for 199,- og vi betaler Fragten. Hurtigt Service. Danmarks Største Udvalg af Remme.",,
polar-a,Merge,Polar A,"Velkommen til et godt udvalg af Polar A urremme. Fylder du kurven for mere end 199kroner, så får du <b>gratis levering.</b>.",all conditions,Tag,Equals,Polar A,Polar A Urremme | Mægtigt Sortiment af Urremme til Polar A,"Uremme der passer perfekt til Polar A. Vores lager er fyldt med flotte remme til ganske få kroner. Køber du for mere end 199kroner, betaler vi fragten.",parent-collection,
polar-a300,Merge,Polar A300,Er det på tide at udskifte remmen? Du finder et vælg af <b>Polar A300 urremme</b> her hos Danmarks største udvalg.,all conditions,Tag,Equals,Polar A300,"Polar A300 Urremme | Fri Levering over 199,-",Ny Polar A300 rem? Så er dette stedet for dig! Vi har det største udvalg i Danmark. Hurtig Levering.,,Polar A
polar-a360,Merge,Polar A360,Mangler du en elegant eller behagelig Polar A360 urrem? Så er du heldig at du er landet hos os! Hos urrem.dk finder du Danmarks Største Udvalg af Polar A360 remme.,all conditions,Tag,Equals,Polar A360,Polar A360 Urremme | Mægtigt Udvalg,"Kæmpe Udvalg af Polar A360 Urremme. Køb for 199,- og vi betaler Fragten. Hurtigt Service. Danmarks Største Udvalg af Remme.",,Polar A
polar-a370,Merge,Polar A370,"Stort udvalg af Polar A370 urremme. Hvis din stil er sporty eller klassisk, så kan du med garanti finde en urrem, der passer netop dig. Bestil inden. kl. 15 og vi sender hjem til dig i dag.",all conditions,Tag,Equals,Polar A370,Polar A370 Remme | Køb ny Urrem til Polar A370 Her,Stort Sortiment af Polar A370 Urremme. Hurtig Levering. Bedste udvalg og høj service. Find din nye rem i dag.,,Polar A
polar-ft,Merge,Polar FT,"Find en ny Polar FT rem i dag, eller få et ekstra, så du kan skifte imellem forskellige. En urrem kan give dit smartwatch et helt nyt look, og matche din egen personlige stil.",all conditions,Tag,Equals,Polar FT,"Polar FT Urremme | Hurtig & Fri Fragt over 199,-","Mangler du en ny Polar FT urrem? Her finder du et stort udvalg af alle slags remme. GRATIS fragt ved køb over 199,-",parent-collection,
polar-ft4,Merge,Polar FT4,"Vi har altid den urrem, som du mangler til Polar FT4. Bestiller du får mere end 199kr, så <b>betaler vi fragten</b>. Så fyld kurven op! Går du til kassen inden kl. 15, så sender vi din ordre afsted samme dag.",all conditions,Tag,Equals,Polar FT4,Polar FT4 Remme | Find en ny rem til Polar FT4 Her,"Alle slags Polar FT4 Urremme. Danmarks Største Udvalg. Gratis Levering ved køb over 199,-",,Polar FT
polar-ft60,Merge,Polar FT60,Danmarks Bedste Udvalg af Polar FT60 urremme. Den rem du leder efter finder du her på siden. Vi har i mange forskellige materialer og stilarter. Find den urrem du mangler i dag!,all conditions,Tag,Equals,Polar FT60,Polar FT60 Remme | Bedste Udvalg Remme til Polar FT60,"Kæmpe Udvalg af Polar FT60 Urremme. Køb for 199,- og vi betaler Fragten. Hurtigt Service. Danmarks Største Udvalg af Remme.",,Polar FT
polar-ft7,Merge,Polar FT7,"Vil du gøre dit smartwatch mere personligt? Vi har et stort sortiment af alle slags Polar FT7 urremme, du finder remmene i massevis af farver og materialer. Så kan du finde netop den urrem, som du går og leder efter.",all conditions,Tag,Equals,Polar FT7,Polar FT7 Urremme | Kæmpestort Udvalg af Remme til Polar FT7,"Kæmpe Udvalg af Polar FT7 Urremme. Køb for 199,- og vi betaler Fragten. Hurtigt Service. Danmarks Største Udvalg af Remme.",,Polar FT
polar-grit,Merge,Polar Grit,"Vi har altid den urrem, som du mangler til Polar Grit. Bestiller du får mere end 199kr, så <b>betaler vi fragten</b>. Så fyld kurven op! Går du til kassen inden kl. 15, så sender vi din ordre afsted samme dag.",all conditions,Tag,Equals,Polar Grit,Polar Grit Urremme | Mægtigt Udvalg af Urremme til Polar Grit,"Velkommen til et hav af Polar Grit Urremme. Bestil inden kl. 15 og vi sender samme dag. Fri Fragt ved køb over 199,-",parent-collection,
polar-grit-x,Merge,Polar Grit X,"Her har du hele vores udvalg af remme til Polar Grit X. Med en ny urrem kan du gøre dit smartwatch mere personlig. De er nemme at udskifte, så du kan også fylde skuffen med forskellige urremme og udskifte dem efter behov. Køber du får mere end 199,- så leverer vi kvit og frit.",all conditions,Tag,Equals,Polar Grit X,Polar Grit X Remme | Mægtigt Sortiment af Remme til Polar Grit X,"Alle slags Polar Grit X Urremme. Danmarks Største Udvalg. Gratis Levering ved køb over 199,-",,Polar Grit
polar-grit-x-pro,Merge,Polar Grit X Pro,"De bedste urremme til Polar Grit X Pro. Mangler du en ny rem til løbeturen eller når du skal til møde? Vi tilbyder alle slags remme, der passer til dig og dit smartwatch. <b>Gratis Fragt</b> ved køb for mere end 199kr.",all conditions,Tag,Equals,Polar Grit X Pro,Polar Grit X Pro Urremme | Stort Sortiment af Remme til Polar Grit X Pro,"Uremme der passer perfekt til Polar Grit X Pro. Vores lager er fyldt med flotte remme til ganske få kroner. Køber du for mere end 199kroner, betaler vi fragten.",,Polar Grit
polar-ignite,Merge,Polar Ignite,"Har du brug for en Polar Ignite urrem, så er du landet på det helt rigtige sted. Vi har et kæmpe udvalg af remme i forskellige farver og materialer.",all conditions,Tag,Equals,Polar Ignite,Polar Ignite Remme | Enormt Udvalg,"Mangler du en ny Polar Ignite urrem? Her finder du et stort udvalg af alle slags remme. GRATIS fragt ved køb over 199,-",,Polar Ignite Series
polar-ignite-2,Merge,Polar Ignite 2,"Har du brug for en Polar Ignite 2 urrem, så er du landet på det helt rigtige sted. Vi har et kæmpe udvalg af remme i forskellige farver og materialer.",all conditions,Tag,Equals,Polar Ignite 2,"Polar Ignite 2 Urremme | Gratis Levering over 199,-","Kæmpe Udvalg af Polar Ignite 2 Urremme. Køb for 199,- og vi betaler Fragten. Hurtigt Service. Danmarks Største Udvalg af Remme.",,Polar Ignite Series
polar-ignite-series,Merge,Polar Ignite Series,"Vil du gøre dit smartwatch mere personligt? Vi har et stort sortiment af alle slags Polar Ignite Series urremme, du finder remmene i massevis af farver og materialer. Så kan du finde netop den urrem, som du går og leder efter.",all conditions,Tag,Equals,Polar Ignite Series,"Polar Ignite Series Remme | Bedste Udvalg - Fri Fragt over 199,-","Uremme til Polar Ignite Series hos Danmarks Største Udvalg. Bestil inden. Kl 15 og vi sender i Dag. Køb for mere end 199,- og du får Gratis Fragt.",parent-collection,
polar-m,Merge,Polar M,"Enormt udvalg af urremme til Polar M . Vi har helt sikkert en rem, som du kan bruge.",all conditions,Tag,Equals,Polar M,Polar M Urremme | Kæmpestort Udvalg af Remme til Polar M,Ny Polar M rem? Så er dette stedet for dig! Vi har det største udvalg i Danmark. Hurtig Levering.,parent-collection,
polar-m200,Merge,Polar M200,Gør dit Polar M200 ur mere personlig med et ny rem. Vi har et stort udvalg af alle slags urremme med perfekt pasform.,all conditions,Tag,Equals,Polar M200,Polar M200 Remme | Gigantisk Udvalg af Remme til Polar M200,"Velkommen til et hav af Polar M200 Urremme. Bestil inden kl. 15 og vi sender samme dag. Fri Fragt ved køb over 199,-",,Polar M
polar-m400,Merge,Polar M400,Danmarks Bedste Udvalg af Polar M400 urremme. Den rem du leder efter finder du her på siden. Vi har i mange forskellige materialer og stilarter. Find den urrem du mangler i dag!,all conditions,Tag,Equals,Polar M400,"Polar M400 Remme | Hurtig & Gratis Levering over 199,-",Stort udvalg af remme til Polar M400. Danmarks Største udvalg af Smartwatch urremme. Vi sender inden kl. 15 i dag.,,Polar M
polar-m430,Merge,Polar M430,"Skal du bruge en ny Polar M430 urrem til enten træning eller hverdagen, så har vi heldigvis et hav af forskellige remme, som du kan vælge imellem.",all conditions,Tag,Equals,Polar M430,Polar M430 Urremme | Stort Udvalg,"Alle slags Polar M430 Urremme. Danmarks Største Udvalg. Gratis Levering ved køb over 199,-",,Polar M
polar-m450,Merge,Polar M450,Mangler du en ny Polar M450 urrem? Så kan vi hjælpe dig. Vi har det største udvalg af urremme i Danmark.,all conditions,Tag,Equals,Polar M450,Polar M450 Urremme | Stort Sortiment af Urremme til Polar M450,Ny Polar M450 rem? Så er dette stedet for dig! Vi har det største udvalg i Danmark. Hurtig Levering.,,Polar M
polar-m600,Merge,Polar M600,"Her kan du finde en ny Polar M600 urrem. Du er heldigvis landet på danmarks største udvalg af smartwatch remme, så du kan helt sikkert finde noget du kan bruge.",all conditions,Tag,Equals,Polar M600,Polar M600 Remme | Køb ny rem til Polar M600 Her,Lækre remme til Polar M600. Kæmpe Udvalg. Hurtig Levering og FRI Fragt over 199kr.,,Polar M
polar-unite,Merge,Polar Unite,"Stort udvalg af Polar Unite urremme. Hvis din stil er sporty eller klassisk, så kan du med garanti finde en urrem, der passer netop dig. Bestil inden. kl. 15 og vi sender hjem til dig i dag.",all conditions,Tag,Equals,Polar Unite,"Polar Unite Urremme | Bedste Udvalg - Fri Fragt over 199,-",Lækre remme til Polar Unite. Kæmpe Udvalg. Hurtig Levering og FRI Fragt over 199kr.,,
polar-v,Merge,Polar V,"Skal du bruge en ny Polar V urrem til enten træning eller hverdagen, så har vi heldigvis et hav af forskellige remme, som du kan vælge imellem.",all conditions,Tag,Equals,Polar V,Polar V Remme | Kæmpestort Udvalg,"Mangler du en ny Polar V urrem? Her finder du et stort udvalg af alle slags remme. GRATIS fragt ved køb over 199,-",parent-collection,
polar-v650,Merge,Polar V650,"Velkommen til et godt udvalg af Polar V650 urremme. Fylder du kurven for mere end 199kroner, så får du <b>gratis levering.</b>.",all conditions,Tag,Equals,Polar V650,"Polar V650 Remme | Hurtig & Gratis Levering over 199,-","Uremme til Polar V650 hos Danmarks Største Udvalg. Bestil inden. Kl 15 og vi sender i Dag. Køb for mere end 199,- og du får Gratis Fragt.",,Polar V
polar-v800,Merge,Polar V800,"Vi har altid den urrem, som du mangler til Polar V800. Bestiller du får mere end 199kr, så <b>betaler vi fragten</b>. Så fyld kurven op! Går du til kassen inden kl. 15, så sender vi din ordre afsted samme dag.",all conditions,Tag,Equals,Polar V800,Polar V800 Urremme | Danmarks Største Udvalg af remme til Polar V800,Lækre remme til Polar V800. Kæmpe Udvalg. Hurtig Levering og FRI Fragt over 199kr.,,Polar V
polar-vantage-m,Merge,Polar Vantage M,"Velkommen til et godt udvalg af Polar Vantage M urremme. Fylder du kurven for mere end 199kroner, så får du <b>gratis levering.</b>.",all conditions,Tag,Equals,Polar Vantage M,"Polar Vantage M Remme | Stort Vareudvalg - Fri Fragt over 199,-","Alle slags Polar Vantage M Urremme. Danmarks Største Udvalg. Gratis Levering ved køb over 199,-",,Polar Vantage Series
polar-vantage-m2,Merge,Polar Vantage M2,Er det på tide at udskifte remmen? Du finder et vælg af <b>Polar Vantage M2 urremme</b> her hos Danmarks største udvalg.,all conditions,Tag,Equals,Polar Vantage M2,Polar Vantage M2 Urremme | Giga Udvalg,"Uremme til Polar Vantage M2 hos Danmarks Største Udvalg. Bestil inden. Kl 15 og vi sender i Dag. Køb for mere end 199,- og du får Gratis Fragt.",,Polar Vantage Series
polar-vantage-series,Merge,Polar Vantage Series,"Stort udvalg af Polar Vantage Series urremme. Hvis din stil er sporty eller klassisk, så kan du med garanti finde en urrem, der passer netop dig. Bestil inden. kl. 15 og vi sender hjem til dig i dag.",all conditions,Tag,Equals,Polar Vantage Series,Polar Vantage Series Urremme | Største Udvalg i Danmark,"Velkommen til et hav af Polar Vantage Series Urremme. Bestil inden kl. 15 og vi sender samme dag. Fri Fragt ved køb over 199,-",parent-collection,
polar-vantage-v,Merge,Polar Vantage V,"Har du brug for en Polar Vantage V urrem, så er du landet på det helt rigtige sted. Vi har et kæmpe udvalg af remme i forskellige farver og materialer.",all conditions,Tag,Equals,Polar Vantage V,Polar Vantage V Remme | Lækre Urremme til Polar Vantage V,"Alle slags Polar Vantage V Urremme. Danmarks Største Udvalg. Gratis Levering ved køb over 199,-",,Polar Vantage Series
polar-vantage-v2,Merge,Polar Vantage V2,"De bedste urremme til Polar Vantage V2. Mangler du en ny rem til løbeturen eller når du skal til møde? Vi tilbyder alle slags remme, der passer til dig og dit smartwatch. <b>Gratis Fragt</b> ved køb for mere end 199kr.",all conditions,Tag,Equals,Polar Vantage V2,Polar Vantage V2 Remme | Mega Udvalg af remme til Polar Vantage V2,"Mangler du en ny Polar Vantage V2 urrem? Her finder du et stort udvalg af alle slags remme. GRATIS fragt ved køb over 199,-",,Polar Vantage Series
realme,Merge,Realme,"Her har du hele vores udvalg af remme til Realme. Med en ny urrem kan du gøre dit smartwatch mere personlig. De er nemme at udskifte, så du kan også fylde skuffen med forskellige urremme og udskifte dem efter behov. Køber du får mere end 199,- så leverer vi kvit og frit.",all conditions,Tag,Equals,Realme,"Realme Remme | Fri Fragt over 199,-",Stort Sortiment af Realme Urremme. Hurtig Levering. Bedste udvalg og høj service. Find din nye rem i dag.,,
realme-band,Merge,Realme Band,"Velkommen til et godt udvalg af Realme Band urremme. Fylder du kurven for mere end 199kroner, så får du <b>gratis levering.</b>.",all conditions,Tag,Equals,Realme Band,Realme Band Urremme | Bedste Sortiment af Urremme til Realme Band,Stort udvalg af remme til Realme Band. Danmarks Største udvalg af Smartwatch urremme. Vi sender inden kl. 15 i dag.,,
realme-band-2,Merge,Realme Band 2,Gør dit Realme Band 2 ur mere personlig med et ny rem. Vi har et stort udvalg af alle slags urremme med perfekt pasform.,all conditions,Tag,Equals,Realme Band 2,Realme Band 2 Urremme | Bedste Udvalg i Danmark,"Alle slags Realme Band 2 Urremme. Danmarks Største Udvalg. Gratis Levering ved køb over 199,-",,
realme-watch,Merge,Realme Watch,Danmarks Bedste Udvalg af Realme Watch urremme. Den rem du leder efter finder du her på siden. Vi har i mange forskellige materialer og stilarter. Find den urrem du mangler i dag!,all conditions,Tag,Equals,Realme Watch,Realme Watch Remme | Største Udvalg i Danmark,Er det på tide at udskifte din Realme Watch rem? Her kan du købe en nye til få penge. Vi sender inden kl. 15,,
realme-watch-2,Merge,Realme Watch 2,"Vil du gøre dit smartwatch mere personligt? Vi har et stort sortiment af alle slags Realme Watch 2 urremme, du finder remmene i massevis af farver og materialer. Så kan du finde netop den urrem, som du går og leder efter.",all conditions,Tag,Equals,Realme Watch 2,"Realme Watch 2 Remme | Fri Levering over 199,-",Lækre remme til Realme Watch 2. Kæmpe Udvalg. Hurtig Levering og FRI Fragt over 199kr.,,
realme-watch-2-pro,Merge,Realme Watch 2 Pro,Gør dit Realme Watch 2 Pro ur mere personlig med et ny rem. Vi har et stort udvalg af alle slags urremme med perfekt pasform.,all conditions,Tag,Equals,Realme Watch 2 Pro,"Realme Watch 2 Pro Urremme | Giga Udvalg - Fri Fragt over 199,-","Kæmpe Udvalg af Realme Watch 2 Pro Urremme. Køb for 199,- og vi betaler Fragten. Hurtigt Service. Danmarks Største Udvalg af Remme.",,
realme-watch-s,Merge,Realme Watch S,"Her har du hele vores udvalg af remme til Realme Watch S. Med en ny urrem kan du gøre dit smartwatch mere personlig. De er nemme at udskifte, så du kan også fylde skuffen med forskellige urremme og udskifte dem efter behov. Køber du får mere end 199,- så leverer vi kvit og frit.",all conditions,Tag,Equals,Realme Watch S,Realme Watch S Remme | Bedste Udvalg Urremme til Realme Watch S,"Kæmpe Udvalg af Realme Watch S Urremme. Køb for 199,- og vi betaler Fragten. Hurtigt Service. Danmarks Største Udvalg af Remme.",,
